url,title,description,h1,lead,service,category,country_hint,problems,fixes,errors,faq1_q,faq1_a,faq2_q,faq2_a,extra_html,noindex
/brands/atlas-vpn-ios-setup-2025/,"Atlas VPN на iPhone (iOS): настройка и ошибки (2025)","Обфускация, протоколы и DNS — настройка Atlas VPN на iOS с нуля.","Atlas VPN на iPhone — полная настройка","Включаем обфускацию, выбираем протокол и чиним типовые ошибки.","Atlas VPN на iPhone (iOS)","other","Россия","Не подключается|Нет профиля|LTE не тянет|Звонки/медиа зависают|Иконка пропадает","Разрешить профиль|WG/OVPN|Обфускация|Сброс сетей|DNS 1.1.1.1","Auth|Timeout|DNS|Reset","Когда включать обфускацию?","При DPI/фильтрации — иначе выключайте для скорости.","Какие страны быстрее?","NL/DE/CZ/FI — выбирайте по пингу.",,"no"
/brands/atlas-vpn-windows-11-setup-2025/,"Atlas VPN на Windows 11: установка и фиксы (2025)","Пошаговая установка Atlas VPN: драйверы, обфускация, TCP/443, DNS.","Atlas VPN на Windows 11 — настройка","Ставим клиент, чиним сеть, включаем TCP/443 и настраиваем DNS.","Atlas VPN на Windows 11","other","Россия","Ошибка TAP/WG|Нет доступа к сети|Обрывы|Сайты не грузятся|Высокий пинг","Переустановить драйверы|TCP/443|Отключить фильтры|Flush DNS|Смена узла","TAP error|DNS_PROBE|TLS|WFP","Поможет ли смена города в стране?","Да — диапазоны IP различаются по «чистоте».","Как ускорить соединение?","Кабель + 5 ГГц и ближний сервер.",,"no"
/brands/hide-me-ios-setup-2025/,"Hide.me на iPhone (iOS): настройка и ошибки (2025)","Stealth Guard, протоколы и DNS — как правильно настроить Hide.me на iOS.","Hide.me на iPhone — полная настройка","Включаем Stealth Guard, выбираем протокол и устраняем утечки.","Hide.me на iPhone (iOS)","other","Россия","Не подключается|Нет профиля|LTE рвётся|DNS-утечки|Пинг высокий","Разрешить профиль|WG/OVPN/IKEv2|Stealth Guard|Сброс сетей|DNS ручной","Auth|Timeout|DNS leak|Reset","Stealth Guard держать всегда?","При блоках/утечках — да, иначе можно выключать.","Как проверить утечки?","Сделайте DNS/WebRTC-тесты после подключения.",,"no"
/brands/hide-me-windows-11-setup-2025/,"Hide.me на Windows 11: установка и фиксы (2025)","Инсталляция Hide.me: Stealth Guard, протоколы, TCP/443, DNS и драйверы.","Hide.me на Windows 11 — настройка","Чиним TAP/WG, включаем нужные режимы и возвращаем доступ к сервисам.","Hide.me на Windows 11","other","Россия","Ошибка установки|Нет сети|DNS-утечки|Обрывы|Высокий пинг","Переустановка драйверов|TCP/443|Stealth Guard|Отключить фильтры|Flush DNS","TAP error|DNS leak|TLS|Firewall","Можно ли исключить банки/локальные сайты?","Через split tunneling/правила в клиенте.","Почему «403» на сайтах?","IP могли забанить — смените город/узел/страну.",,"no"
/brands/privatevpn-ios-setup-2025/,"PrivateVPN на iPhone (iOS): настройка и ошибки (2025)","Stealth VPN, протоколы и DNS — корректная настройка PrivateVPN на iOS.","PrivateVPN на iPhone — полная настройка","Включаем Stealth VPN при DPI, настраиваем протоколы и DNS.","PrivateVPN на iPhone (iOS)","other","Россия","Не подключается|Нет профиля|LTE не работает|Медиа не грузится|Пинг скачет","Разрешить профиль|WG/OVPN|Stealth VPN|Сброс сетей|DNS 1.1.1.1","Auth|Timeout|DNS|Reset","Stealth VPN всегда нужен?","Только при фильтрации; без него скорость выше.","Как выбрать узел для звонков?","Ближний EU-сервер с наименьшим пингом.",,"no"
/brands/privatevpn-windows-11-setup-2025/,"PrivateVPN на Windows 11: установка и фиксы (2025)","Настройка PrivateVPN: Stealth, TCP/443, DNS, исправление TAP/TUN ошибок.","PrivateVPN на Windows 11 — настройка","Ставим клиент, включаем Stealth/TCP при блоках и чиним сеть.","PrivateVPN на Windows 11","other","Россия","Не коннектится|Нет сети|DNS-ошибки|Обрывы|Высокий пинг","Переустановка драйверов|TCP/443|Отключить фильтры|Flush DNS|Смена узла","TAP error|DNS_PROBE|TLS|WFP block","Нужно ли менять MTU?","Да, иногда снижает лоссы и ускоряет коннект.","Как оставить локальные ресурсы?","Через split tunneling/маршрутизацию подсетей.",,"no"
/brands/hma-ios-setup-2025/,"HMA на iPhone (iOS): настройка и ошибки (2025)","IP Shuffle, протоколы и DNS — как настроить HMA на iOS.","HMA на iPhone — полная настройка","Включаем IP Shuffle, подбираем протокол/узел и чиним сбои.","HMA на iPhone (iOS)","other","Россия","Не подключается|Нет профиля|LTE не работает|Медиа тормозит|Иконка пропадает","Разрешить профиль|OVPN/WG|IP Shuffle|Сброс сетей|DNS 1.1.1.1","Auth|Timeout|DNS|Reset","Нужен ли IP Shuffle всегда?","Полезен при банах IP; может сбрасывать сессии — учитывайте.","Какие узлы выбрать?","NL/DE/CZ — тестируйте города по пингу.",,"no"
/brands/hma-windows-11-setup-2025/,"HMA на Windows 11: установка и фиксы (2025)","Правильная инсталляция HMA: драйверы, TCP/443, IP Shuffle, DNS.","HMA на Windows 11 — настройка","Чиним TAP, включаем TCP/443 и настраиваем правила фаервола/DNS.","HMA на Windows 11","other","Россия","Не ставится|Нет интернета|403 на сайтах|DNS-утечки|Обрывы","Переустановить драйвер|TCP/443|Отключить фильтры|Flush DNS|Смена узла","TAP error|DNS_PROBE|TLS|Firewall","Почему часто 403?","Общие IP попадают в бан-листы — меняйте города/страны.","Как ускорить загрузку?","Проводной интернет и близкий узел.",,"no"
/brands/strongvpn-ios-setup-2025/,"StrongVPN на iPhone (iOS): настройка и ошибки (2025)","Scramble, протоколы и DNS — корректная настройка StrongVPN на iOS.","StrongVPN на iPhone — полная настройка","Включаем Scramble при DPI, настраиваем протоколы и чиним медиа/звонки.","StrongVPN на iPhone (iOS)","other","Россия","Не подключается|Нет профиля|LTE рвётся|Медиа не грузится|Пинг высок","Разрешить профиль|OVPN/WG|Scramble|Сброс сетей|DNS 1.1.1.1","Auth|Timeout|DNS|Reset","Всегда ли включать Scramble?","Нет — используйте при блокировках, без него быстрее.","Какие страны выбрать?","NL/DE/FR; запас — CZ/FI.",,"no"
/brands/strongvpn-windows-11-setup-2025/,"StrongVPN на Windows 11: установка и фиксы (2025)","Настройка StrongVPN: Scramble, TCP/443, DNS, исправление драйверов.","StrongVPN на Windows 11 — настройка","Чиним TAP/TUN, включаем Scramble/TCP при фильтрации и настраиваем DNS.","StrongVPN на Windows 11","other","Россия","Не коннектится|Нет сети|DNS-ошибки|Постоянные обрывы|Высокий пинг","Переустановка драйверов|TCP/443|Scramble|Отключить фильтры|Flush DNS","TAP error|DNS_PROBE|TLS|WFP conflict","Можно ли исключить игровые сервисы?","Да, через split tunneling/политику маршрутизации.","Как стабилизировать туннель?","Понизьте MTU и держите 1–2 проверенных узла.",,"no"
/brands/norton-secure-vpn-ios-setup-2025/,"Norton Secure VPN на iPhone (iOS): настройка и ошибки (2025)","Split tunneling, протоколы и DNS — настройка Norton Secure VPN на iOS.","Norton Secure VPN на iPhone — полная настройка","Подключаем, настраиваем разделение трафика и устраняем частые сбои.","Norton Secure VPN на iPhone (iOS)","other","Россия","Не подключается|Нет профиля|LTE не работает|DNS-сбои|Звонки рвутся","Разрешить профиль|Протокол клиента|Split tunneling|Сброс сетей|DNS 1.1.1.1","Auth|Timeout|DNS|Reset","Антивирус мешает VPN?","Иногда — временно отключите веб-щит при отладке.","Как сохранить доступ к банкам?","Добавьте их в список исключений split tunneling.",,"no"
/brands/norton-secure-vpn-windows-11-setup-2025/,"Norton Secure VPN на Windows 11: установка и фиксы (2025)","Инсталляция Norton Secure VPN: протоколы, split tunneling, TCP/443, DNS.","Norton Secure VPN на Windows 11 — настройка","Чиним драйверы, конфликты безопасности, включаем TCP/443 и DNS.","Norton Secure VPN на Windows 11","other","Россия","Ошибка установки|Нет сети|DNS-утечки|Сайты не открываются|Пинг высокий","Переустановить драйвер|TCP/443|Split tunneling|Отключить фильтры|Flush DNS","TAP error|DNS leak|TLS|Firewall","Можно ли объединить с антивирусом?","Да, но настройте исключения в фаерволе.","Почему не грузятся сайты?","IP забанен/проблемы с DNS — смените узел и очистите кэш.",,"no"
/brands/avast-secureline-ios-setup-2025/,"Avast SecureLine на iPhone (iOS): настройка и ошибки (2025)","Правильная настройка SecureLine на iOS: протоколы, DNS, TCP/443.","Avast SecureLine на iPhone — полная настройка","Подключаем, настраиваем DNS, устраняем проблемы с LTE/звонками.","Avast SecureLine на iPhone (iOS)","other","Россия","Не подключается|Нет профиля|LTE не тянет|Медиа не грузится|Пинг высокий","Разрешить профиль|OVPN/WG|TCP/443|Сброс сетей|DNS ручной","Auth|Timeout|DNS|Reset","Конфликтует с антивирусом?","Отключите сетевые фильтры на время диагностики.","Какие узлы выбрать?","Ближние EU — NL/DE/CZ.",,"no"
/brands/avast-secureline-windows-11-setup-2025/,"Avast SecureLine на Windows 11: установка и фиксы (2025)","Настройка SecureLine: драйверы, TCP/443, DNS, устранение конфликтов.","Avast SecureLine на Windows 11 — настройка","Чиним TAP/TUN, включаем TCP/443, убираем конфликты с защитными модулями.","Avast SecureLine на Windows 11","other","Россия","Не ставится|Нет сети|403 на сайтах|DNS-утечки|Обрывы","Переустановка драйверов|TCP/443|Отключить веб-щит|Flush DNS|Смена города","TAP error|DNS_PROBE|TLS|Firewall","Почему 403?","Общий IP в бан-листах — переключите город/страну.","Как ускорить запуск?","Автологин и ближний избранный узел.",,"no"
/brands/opera-vpn-ios-setup-2025/,"Opera VPN на iPhone (iOS): настройка и ошибки (2025)","Почему встроенный Opera VPN на iOS часто блокируется и что делать вместо.","Opera VPN на iPhone — варианты","Используйте отдельный VPN-клиент с обфускацией и EU-узлами, настройте DNS.","Opera VPN на iPhone (iOS)","other","Россия","Не подключается|Медленно|Не грузятся сайты|Звонки не идут|Иконка VPN исчезает","Отдельный VPN-клиент|Обфускация|EU узлы|TCP/443|DNS 1.1.1.1","Proxy limit|DNS error|Timeout|Reset","Opera VPN — полноценный VPN?","Нет, это прокси-уровень в браузере, его легко блокируют.","Что взять вместо?","Любой клиент с OpenVPN-TCP/443 или обфускацией.",,"no"
/brands/opera-vpn-windows-11-setup-2025/,"Opera VPN на Windows 11: установка и фиксы (2025)","Если встроенный VPN в Opera не спасает: альтернативные клиенты, TCP/443, DNS.","Opera VPN на Windows 11 — варианты","Ставим полноценный VPN-клиент, включаем TCP/443 и настраиваем DNS/исключения.","Opera VPN на Windows 11","other","Россия","Не открываются сайты|Прокси-ошибки|Буферизация|DNS-сбои|Медленно","Полноценный VPN-клиент|TCP/443|Очистка кэша/DNS|Исключения в браузере","Proxy detected|DNS|Playback|Timeout","Можно ли оставить Opera для серфинга?","Да, а видео/стриминг — через приложение-VPN.","Какие бренды подходят?","Смотри каталог /brands/ с рабочими EU-узлами.",,"no"
/brands/keepsolid-vpn-unlimited-ios-setup-2025/,"KeepSolid VPN Unlimited на iPhone (iOS): настройка и ошибки (2025)","Режим KeepSolid Wise, протоколы и DNS — настройка на iOS.","KeepSolid VPN Unlimited на iPhone — полная настройка","Включаем Wise при DPI, настраиваем протокол/узлы и устраняем сбои.","KeepSolid VPN Unlimited на iPhone (iOS)","other","Россия","Не подключается|Нет профиля|LTE не работает|Звонки лагают|DNS-сбои","Разрешить профиль|Wise/OVPN/WG|TCP/443|Сброс сетей|DNS ручной","Auth|Timeout|DNS|Reset","Всегда ли нужен Wise?","При фильтрации — да; без неё быстрее без Wise.","Какие локации выбрать?","NL/DE/PL с наименьшим пингом.",,"no"
/brands/keepsolid-vpn-unlimited-windows-11-setup-2025/,"KeepSolid VPN Unlimited на Windows 11: установка и фиксы (2025)","Настройка KeepSolid: Wise, TCP/443, DNS, исправление драйверов.","KeepSolid VPN Unlimited на Windows 11 — настройка","Поднимаем туннель, включаем Wise/TCP при DPI и чиним сеть.","KeepSolid VPN Unlimited на Windows 11","other","Россия","Не ставится|Нет интернета|DNS-утечки|Обрывы|Высокий пинг","Переустановка драйверов|Wise/TCP/443|Отключить фильтры|Flush DNS|Смена узла","TAP error|DNS leak|TLS|Firewall","Поддерживается ли Wise в Windows-клиенте?","Да, проверьте в настройках протоколов.","Как обойти бан сайтов?","Меняйте города/страны, чистите кэш и DNS-кеш.",,"no"
/brands/zenmate-ios-setup-2025/,"ZenMate на iPhone (iOS): настройка и ошибки (2025)","Корректная установка ZenMate на iOS: протоколы, TCP/443, DNS.","ZenMate на iPhone — полная настройка","Подключаем ZenMate, выбираем узлы/протоколы и чиним типовые ошибки.","ZenMate на iPhone (iOS)","other","Россия","Не подключается|Нет профиля|LTE режет|Медиа не грузится|Пинг высокий","Разрешить профиль|OVPN/WG|TCP/443|Сброс сетей|DNS 1.1.1.1","Auth|Timeout|DNS|Reset","Стоит ли использовать расширение браузера?","Лучше приложение — расширения блокируются чаще.","Как снизить задержку?","Ближний узел + 5 ГГц.",,"no"
/brands/zenmate-windows-11-setup-2025/,"ZenMate на Windows 11: установка и фиксы (2025)","Инсталляция ZenMate: драйверы, TCP/443, DNS и устранение конфликтов.","ZenMate на Windows 11 — настройка","Чиним TAP/TUN, включаем TCP/443, настраиваем DNS и исключения.","ZenMate на Windows 11","other","Россия","Ошибка установки|Нет сети|DNS-ошибки|Обрывы|403 на сайтах","Переустановка драйверов|TCP/443|Отключить фильтры|Flush DNS|Смена города","TAP error|DNS_PROBE|TLS|Firewall","Почему «Proxy detected»?","Общий IP в бан-листах — меняйте города/страны.","Как удержать скорость?","Провод/5 ГГц и близкий узел.",,"no"
/brands/privadovpn-ios-setup-2025/,"PrivadoVPN на iPhone (iOS): настройка и ошибки (2025)","Правильная настройка PrivadoVPN на iOS: протоколы, TCP/443, DNS.","PrivadoVPN на iPhone — полная настройка","Подключаем, настраиваем DNS и устраняем проблемы с LTE/медиа.","PrivadoVPN на iPhone (iOS)","other","Россия","Не подключается|Нет профиля|LTE не работает|Медиа не грузится|Пинг высокий","Разрешить профиль|WG/OVPN|TCP/443|Сброс сетей|DNS 1.1.1.1/8.8.8.8","Auth|Timeout|DNS|Reset","Хватает ли free-версии для iOS?","Для переписки да, но лимит трафика на медиа.", "Как выбрать узел?","Смотрите пинг/нагрузку и меняйте города внутри страны.",,"no"
/brands/privadovpn-windows-11-setup-2025/,"PrivadoVPN на Windows 11: установка и фиксы (2025)","Инсталляция PrivadoVPN: драйверы, TCP/443, DNS и устранение ошибок.","PrivadoVPN на Windows 11 — настройка","Чиним TAP/TUN, включаем TCP/443, убираем конфликты фаервола.","PrivadoVPN на Windows 11","other","Россия","Не ставится|Нет сети|DNS-утечки|Обрывы|Плохая скорость","Переустановить драйверы|TCP/443|Отключить фильтры|Flush DNS|Смена узла","TAP error|DNS leak|TLS|Firewall","Нужен ли SOCKS5?","Для обычного серфинга/стриминга — нет, лучше прямой VPN.","Как ускорить?","Кабель, 5 ГГц и ближний сервер.",,"no"
/brands/f-secure-freedome-ios-setup-2025/,"F-Secure FREEDOME на iPhone (iOS): настройка и ошибки (2025)","Правильная настройка FREEDOME: протоколы, DNS, отключение конфликтующих фильтров.","FREEDOME на iPhone — полная настройка","Подключаем, проверяем модули защиты, настраиваем DNS и чиним сбои.","F-Secure FREEDOME на iPhone (iOS)","other","Россия","Не подключается|Нет профиля|DNS-сбои|LTE не тянет|Звонки рвутся","Разрешить профиль|Протокол клиента|Отключить лишние фильтры|Сброс сетей|DNS 1.1.1.1","Auth|DNS error|Timeout|Reset","Мешают ли защитные модули?","Да — временно выключите веб-щит/antitracker.","Какие узлы выбрать?","Ближние EU (NL/DE/FR) с низким пингом.",,"no"
/brands/f-secure-freedome-windows-11-setup-2025/,"F-Secure FREEDOME на Windows 11: установка и фиксы (2025)","Настройка FREEDOME: протоколы, TCP/443, DNS, устранение конфликтов с защитой.","FREEDOME на Windows 11 — настройка","Чиним драйверы, убираем блоки антивируса, настраиваем DNS и порты.","F-Secure FREEDOME на Windows 11","other","Россия","Не ставится|Нет сети|DNS-утечки|Сайты не открываются|Обрывы","Переустановить драйвер|TCP/443|Отключить веб-щит|Flush DNS|Смена узла","TAP error|DNS leak|TLS|Firewall","Можно ли оставить антивирус включённым?","Да, но добавьте исключения для VPN-клиента.","Почему 403?","IP в списках — смените город/страну и почистите кэш.",,"no"
/brands/bitdefender-vpn-ios-setup-2025/,"Bitdefender VPN на iPhone (iOS): настройка и ошибки (2025)","Корректная настройка Bitdefender VPN на iOS: протоколы, DNS, TCP/443.","Bitdefender VPN на iPhone — полная настройка","Подключаем, настраиваем DNS и устраняем конфликты с защитными модулями.","Bitdefender VPN на iPhone (iOS)","other","Россия","Не подключается|Нет профиля|DNS-сбои|LTE не работает|Звонки лагают","Разрешить профиль|OVPN/WG|TCP/443|Сброс сетей|DNS 1.1.1.1/8.8.8.8","Auth|DNS error|Timeout|Reset","Может мешать антивирус?","Да — временно отключите сетевой щит при отладке.","Как выбрать узел?","Ближние EU и разные города внутри страны.",,"no"
/brands/bitdefender-vpn-windows-11-setup-2025/,"Bitdefender VPN на Windows 11: установка и фиксы (2025)","Инсталляция Bitdefender VPN: драйверы, TCP/443, DNS, снятие конфликтов с защитой.","Bitdefender VPN на Windows 11 — настройка","Чиним TAP/TUN, отключаем конфликтующие фильтры и настраиваем DNS.","Bitdefender VPN на Windows 11","other","Россия","Не ставится|Нет интернета|DNS-ошибки|Буферизация|403 на сайтах","Переустановка драйверов|TCP/443|Отключить веб-щит|Flush DNS|Смена узла","TAP error|DNS_PROBE|TLS|Firewall","Почему стриминг ругается на прокси?","Общие IP забанены — меняйте город/страну и чистите кэш.","Как добиться стабильной скорости?","Проводной интернет, 5 ГГц и ближний узел.",,"no"
