url,title,description,h1,lead,service,category,country_hint,problems,fixes,errors,faq1_q,faq1_a,faq2_q,faq2_a,extra_html,noindex
"/guide/internet-outage-penza-2025/","Не работает интернет в Пензе сегодня — что делать (2025)","Пенза: быстрые решения для восстановления доступа + защита через VPN.","Не работает интернет в Пензе сегодня — что делать","Диагностика сети, DNS, VPN — кратко.","Интернет в Пензе","other","—","Нет мобильного интернета|Не открываются сайты|Низкая скорость|Часть сайтов не грузится|Публичный Wi-Fi нестабилен","Самолёт|Перезагрузка|Баланс|4G↔3G|DNS 1.1.1.1/8.8.8.8|VPN|Иная сеть","Нет сети|Нет интернета|DNS_PROBE_FINISHED_NXDOMAIN|ERR_CONNECTION_RESET|Региональные ограничения","Массовый инцидент?","Проверьте на другом устройстве/операторе; следите за каналами провайдера. Массовые — время + VPN.","Открытые точки?","Только с VPN.","","no"
"/guide/internet-outage-lipetsk-2025/","Не работает интернет в Липецке сегодня — что делать (2025)","Липецк: что проверить у себя/у провайдера и как защититься (VPN).","Не работает интернет в Липецке сегодня — что делать","VPN нужен для доступа к ряду сервисов, даже при рабочем интернете.","Интернет в Липецке","other","—","Нет мобильного интернета|Сайты не открываются|Низкая скорость|Часть сайтов не открывается|Проблемы публичного Wi-Fi","Самолёт|Перезагрузка|Баланс/лимиты|4G↔3G|DNS 1.1.1.1/8.8.8.8|VPN|Другая сеть","Нет сети|Нет интернета|DNS_PROBE_FINISHED_NXDOMAIN|ERR_CONNECTION_RESET|Региональные ограничения","Это массовый сбой?","Сверьте с другим устройством/оператором, проверьте каналы провайдера. Массовые — ждём; VPN.","Публичные сети?","VPN обязателен.","","no"
"/guide/internet-outage-tula-2025/","Не работает интернет в Туле сегодня — что делать (2025)","Тула: причины неполадок и быстрые способы вернуть сеть. Плюс VPN.","Не работает интернет в Туле сегодня — что делать","Проверка оператора, перезапуск, DNS, VPN — базовый набор.","Интернет в Туле","other","—","Нет мобильного интернета|Сайты/приложения не грузятся|Скорость низкая|Часть сайтов не открывается|Публичный Wi-Fi нестабилен","Самолёт|Перезагрузка|Лимиты/баланс|4G↔3G|DNS 1.1.1.1/8.8.8.8|VPN|Иная сеть","Нет сети|Нет интернета|DNS_PROBE_FINISHED_NXDOMAIN|ERR_CONNECTION_RESET|Региональные ограничения","Как понять масштаб?","Сверьте работу у другого оператора/устройства; смотрите официальные каналы. Массовые — время + VPN.","Публичный Wi-Fi?","Только через VPN.","","no"
"/guide/internet-outage-kirov-2025/","Не работает интернет в Кирове сегодня — что делать (2025)","Киров: быстрые фиксы и советы по безопасности (VPN).","Не работает интернет в Кирове сегодня — что делать","Без VPN доступ к ряду сервисов невозможен.","Интернет в Кирове","other","—","Нет мобильного интернета|Сайты не открываются|Низкая скорость|Открывается часть сайтов|Публичный Wi-Fi нестабилен","Самолёт|Перезагрузка|Проверка лимитов|4G↔3G|DNS 1.1.1.1/8.8.8.8|VPN|Другая сеть","Нет сети|Нет интернета|DNS_PROBE_FINISHED_NXDOMAIN|ERR_CONNECTION_RESET|Региональные ограничения","Массово/локально?","Проверьте на другом устройстве/операторе; следите за каналами. Массовые — ждём; VPN.","Публичные точки?","Используйте VPN.","","no"
"/guide/internet-outage-cheboksary-2025/","Не работает интернет в Чебоксарах сегодня — что делать (2025)","Чебоксары: диагностика, быстрые решения и защита (VPN).","Не работает интернет в Чебоксарах сегодня — что делать","VPN нужен даже при наличии доступа — многие сервисы заблокированы.","Интернет в Чебоксарах","other","—","Нет мобильного интернета|Сайты/приложения не грузятся|Скорость низкая|Часть сайтов не открывается|Публичный Wi-Fi нестабилен","Самолёт|Перезагрузка|Баланс|4G↔3G|DNS 1.1.1.1/8.8.8.8|VPN|Иная сеть","Нет сети|Нет интернета|DNS_PROBE_FINISHED_NXDOMAIN|ERR_CONNECTION_RESET|Региональные ограничения","Как различить масштаб?","Сверьте с другим устройством/оператором и проверьте каналы провайдеров. Массовые — время + VPN.","Публичные сети?","Только через VPN.","","no"
"/guide/internet-outage-kaliningrad-2025/","Не работает интернет в Калининграде сегодня — что делать (2025)","Калининград: что проверить и как обезопасить соединение (VPN).","Не работает интернет в Калининграде сегодня — что делать","Даже при рабочем интернете часть сервисов не откроется без VPN.","Интернет в Калининграде","other","—","Нет мобильного интернета|Сайты не открываются|Скорость низкая|Открывается часть сайтов|Публичный Wi-Fi нестабилен","Самолёт|Перезагрузка|Лимиты/баланс|4G↔3G|DNS 1.1.1.1/8.8.8.8|VPN|Другая сеть","Нет сети|Нет интернета|DNS_PROBE_FINISHED_NXDOMAIN|ERR_CONNECTION_RESET|Региональные ограничения","Массовый сбой?","Сверьте у другого оператора/устройства; следите за официальными каналами. Массовые — ждём; VPN.","Публичные сети?","Только с VPN.","","no"
"/guide/internet-outage-bryansk-2025/","Не работает интернет в Брянске сегодня — что делать (2025)","Брянск: быстрый план действий и защита через VPN.","Не работает интернет в Брянске сегодня — что делать","Проверка статуса оператора + DNS + VPN.","Интернет в Брянске","other","—","Нет мобильного интернета|Не открываются сайты|Низкая скорость|Часть сайтов не открывается|Публичный Wi-Fi нестабилен","Самолёт|Перезагрузка|Баланс/лимиты|4G↔3G|DNS 1.1.1.1/8.8.8.8|VPN|Иная сеть","Нет сети|Нет интернета|DNS_PROBE_FINISHED_NXDOMAIN|ERR_CONNECTION_RESET|Региональные ограничения","Массово ли это?","Проверьте у другого оператора/устройства и каналы провайдера. Массовые — ожидание; VPN.","Общедоступные сети?","VPN обязателен.","","no"
"/guide/internet-outage-kursk-2025/","Не работает интернет в Курске сегодня — что делать (2025)","Курск: причины, быстрые фиксы и безопасность с VPN.","Не работает интернет в Курске сегодня — что делать","Даже при доступе часть сервисов без VPN не работает.","Интернет в Курске","other","—","Нет мобильного интернета|Сайты не открываются|Низкая скорость|Открывается часть сайтов|П публичный Wi-Fi нестабилен","Самолёт|Перезагрузка|Баланс|4G↔3G|DNS 1.1.1.1/8.8.8.8|VPN|Другая сеть","Нет сети|Нет интернета|DNS_PROBE_FINISHED_NXDOMAIN|ERR_CONNECTION_RESET|Региональные ограничения","Это массовый сбой?","Сверьте с другим устройством/оператором и проверьте каналы провайдера. Массовые — ждём; VPN.","Открытые сети?","Только с VPN.","","no"
"/guide/internet-outage-ivanovo-2025/","Не работает интернет в Иванове сегодня — что делать (2025)","Иваново: как быстро вернуть доступ и обезопасить соединение (VPN).","Не работает интернет в Иванове сегодня — что делать","Чек-лист: самолёт, перезагрузка, DNS, VPN.","Интернет в Иванове","other","—","Нет мобильного интернета|Сайты не открываются|Низкая скорость|Часть сайтов не грузится|Публичный Wi-Fi нестабилен","Самолёт|Перезагрузка|Проверка баланса|4G↔3G|DNS 1.1.1.1/8.8.8.8|VPN|Иная сеть","Нет сети|Нет интернета|DNS_PROBE_FINISHED_NXDOMAIN|ERR_CONNECTION_RESET|Региональные ограничения","Масштаб сбоя?","Сравните с другим устройством/оператором; смотрите каналы провайдеров. Массовые — время + VPN.","Публичный Wi-Fi?","Только через VPN.","","no"
"/guide/internet-outage-magnitogorsk-2025/","Не работает интернет в Магнитогорске сегодня — что делать (2025)","Магнитогорск: диагностика, быстрые решения и VPN.","Не работает интернет в Магнитогорске сегодня — что делать","Даже при рабочем интернете часть сервисов в РФ требуют VPN.","Интернет в Магнитогорске","other","—","Нет мобильного интернета|Не открываются сайты|Низкая скорость/пинг|Часть сайтов не открывается|Публичный Wi-Fi нестабилен","Самолёт|Перезагрузка|Лимиты/баланс|4G↔3G|DNS 1.1.1.1/8.8.8.8|VPN|Другая сеть","Нет сети|Нет интернета|DNS_PROBE_FINISHED_NXDOMAIN|ERR_CONNECTION_RESET|Региональные ограничения","Это массово?","Сверьте с другим устройством/оператором; проверьте официальные сообщения. Массовые — ждём; VPN.","Открытые сети?","Включайте VPN.","","no"
"/guide/internet-outage-ulan-ude-2025/","Не работает интернет в Улан-Удэ сегодня — что делать (2025)","Улан-Удэ: быстрые фиксы, проверка статуса и VPN.","Не работает интернет в Улан-Удэ сегодня — что делать","VPN нужен даже при наличии доступа — часть сервисов заблокирована.","Интернет в Улан-Удэ","other","—","Нет мобильного интернета|Сайты не открываются|Низкая скорость|Часть сайтов не открывается|Проблемы публичного Wi-Fi","Самолёт|Перезагрузка|Баланс/лимиты|4G↔3G|DNS 1.1.1.1/8.8.8.8|VPN|Иная сеть","Нет сети|Нет интернета|DNS_PROBE_FINISHED_NXDOMAIN|ERR_CONNECTION_RESET|Региональные ограничения","Массовый инцидент?","Проверьте у другого оператора/устройства и каналы провайдера. Массовые — время + VPN.","Публичные сети?","Только с VPN.","","no"
"/guide/internet-outage-tver-2025/","Не работает интернет в Твери сегодня — что делать (2025)","Тверь: причины, базовые фиксы и VPN.","Не работает интернет в Твери сегодня — что делать","Короткий чек-лист: самолёт, перезагрузка, DNS, VPN.","Интернет в Твери","other","—","Нет мобильного интернета|Не открываются сайты|Низкая скорость|Открывается часть сайтов|Публичный Wi-Fi нестабилен","Самолёт|Перезагрузка|Баланс|4G↔3G|DNS 1.1.1.1/8.8.8.8|VPN|Другая сеть","Нет сети|Нет интернета|DNS_PROBE_FINISHED_NXDOMAIN|ERR_CONNECTION_RESET|Региональные ограничения","Это массовый сбой?","Сверьте у другого оператора/устройства; следите за каналами провайдера. Массовые — ожидание; VPN.","Публичный Wi-Fi?","VPN обязателен.","","no"
"/guide/internet-outage-stavropol-2025/","Не работает интернет в Ставрополе сегодня — что делать (2025)","Ставрополь: быстрые фиксы и защита соединения (VPN).","Не работает интернет в Ставрополе сегодня — что делать","Даже при рабочем интернете часть сервисов заблокирована — используйте VPN.","Интернет в Ставрополе","other","—","Нет мобильного интернета|Сайты не открываются|Скорость/пинг низкие|Часть сайтов не открывается|Публичный Wi-Fi нестабилен","Самолёт|Перезагрузка|Проверка лимитов|4G↔3G|DNS 1.1.1.1/8.8.8.8|VPN|Иная сеть","Нет сети|Нет интернета|DNS_PROBE_FINISHED_NXDOMAIN|ERR_CONNECTION_RESET|Региональные ограничения","Масштаб?","Проверьте на другом устройстве/операторе и каналы провайдеров. Массовые — ждём; VPN.","Публичные сети?","VPN обязателен.","","no"
"/guide/internet-outage-belgorod-2025/","Не работает интернет в Белгороде сегодня — что делать (2025)","Белгород: причины, быстрые решения и VPN.","Не работает интернет в Белгороде сегодня — что делать","Проверка статуса + DNS + VPN.","Интернет в Белгороде","other","—","Нет мобильного интернета|Не открываются сайты|Низкая скорость|Открывается часть сайтов|Публичный Wi-Fi нестабилен","Самолёт|Перезагрузка|Баланс/лимиты|4G↔3G|DNS 1.1.1.1/8.8.8.8|VPN|Другая сеть","Нет сети|Нет интернета|DNS_PROBE_FINISHED_NXDOMAIN|ERR_CONNECTION_RESET|Региональные ограничения","Массово ли?","Сравните с другим устройством/оператором; смотрите сообщения провайдеров. Массовые — время + VPN.","Публичные сети?","Только с VPN.","","no"
"/guide/internet-outage-sochi-2025/","Не работает интернет в Сочи сегодня — что делать (2025)","Сочи: быстрая диагностика, фиксы и безопасность (VPN).","Не работает интернет в Сочи сегодня — что делать","Даже при доступе ряд сервисов без VPN не работает.","Интернет в Сочи","other","—","Нет мобильного интернета|Не открываются сайты|Низкая скорость|Открывается часть сайтов|Проблемы публичного Wi-Fi","Самолёт|Перезагрузка|Лимиты/баланс|4G↔3G|DNS 1.1.1.1/8.8.8.8|VPN|Иная сеть","Нет сети|Нет интернета|DNS_PROBE_FINISHED_NXDOMAIN|ERR_CONNECTION_RESET|Региональные ограничения","Массово/локально?","Проверьте у другого оператора/устройства и официальные сообщения. Массовые — ждём; VPN.","Публичный Wi-Fi?","VPN обязателен.","","no"
"/guide/internet-outage-surgut-2025/","Не работает интернет в Сургуте сегодня — что делать (2025)","Сургут: причины, базовые проверки и VPN.","Не работает интернет в Сургуте сегодня — что делать","Чек-лист: самолёт, перезагрузка, DNS, VPN.","Интернет в Сургуте","other","—","Нет мобильного интернета|Не открываются сайты|Низкая скорость|Часть сайтов не открывается|Публичный Wi-Fi нестабилен","Самолёт|Перезагрузка|Баланс/лимиты|4G↔3G|DNS 1.1.1.1/8.8.8.8|VPN|Другая сеть","Нет сети|Нет интернета|DNS_PROBE_FINISHED_NXDOMAIN|ERR_CONNECTION_RESET|Региональные ограничения","Как понять масштаб?","Сверьте у другого оператора/устройства; проверьте каналы провайдера. Массовые — ждём; VPN.","Публичные сети?","Только с VPN.","","no"
"/guide/internet-outage-ulyanovsk-duplicate-guard/","Не работает интернет в Ярославле сегодня — что делать (2025)","Техническая строка для проверки парсера. Не публиковать.","Не работает интернет в Ярославле сегодня — что делать","Строка-заглушка.","Служебная страница","other","—","—","—","—","—","—","—","","yes"
