url,title,description,h1,lead,service,category,country_hint,problems,fixes,errors,faq1_q,faq1_a,faq2_q,faq2_a,extra_html,noindex
/guide/internet-outage-lipetsk-2025/,"Не работает интернет в Липецке сегодня — что делать (2025)","Короткая памятка для Липецка.","Не работает интернет в Липецке сегодня","Для «здесь и сейчас»: VPN и DNS вручную.","интернет в Липецке",outage,"Россия","Сайты не открываются|Медленная загрузка|Потери","Смена сети|Рестарт|DNS 1.1.1.1/8.8.8.8|VPN","DNS ошибка|Нет соединения|Ограничение","Почему падают отдельные сервисы?","Фильтрация/маршрутизация — помогает VPN.","Какие страны выбрать в VPN?","Нидерланды/Германия; запас — Финляндия/Чехия.",,no
/guide/internet-outage-tambov-2025/,"Не работает интернет в Тамбове сегодня — что делать (2025)","Сбой в Тамбове: причины и быстрые фиксы.","Не работает интернет в Тамбове сегодня","VPN + ручной DNS — рабочее решение до фикса провайдером.","интернет в Тамбове",outage,"Россия","Нет интернета|Низкая скорость|Потери","Смена сети|Перезапуск устройств|DNS 1.1.1.1/8.8.8.8|VPN","Нет сети|Ошибка DNS|Таймаут","Почему у меня, а у других работает?","Разные сектора БС/нагрузка/оборудование. Проверьте SIM на другом устройстве.","Какие DNS ставить?","1.1.1.1/1.0.0.1 или 8.8.8.8/8.8.4.4.",,no
/guide/internet-outage-penza-2025/,"Не работает интернет в Пензе сегодня — что делать (2025)","Причины сбоев и быстрые решения для Пензы.","Не работает интернет в Пензе сегодня","Проверьте сеть и DNS; при фильтрации — VPN.","интернет в Пензе",outage,"Россия","Сайты не открываются|Падает скорость|Потери","Смена сети|Перезапуск|DNS 1.1.1.1/8.8.8.8|VPN","Нет сети|Ошибка DNS|Ограничение","Как определить масштаб?","Карта сбоев/сообщения провайдера подскажут.","Что помогает до восстановления?","VPN + ручной DNS часто хватает.",,no
/guide/internet-outage-saransk-2025/,"Не работает интернет в Саранске сегодня — что делать (2025)","Что делать при сбоях в Саранске.","Не работает интернет в Саранске сегодня","Для «здесь и сейчас»: VPN + корректный DNS.","интернет в Саранске",outage,"Россия","Не открываются приложения|Низкая скорость|Обрывы","Смена сети|Перезапуск|DNS 1.1.1.1/8.8.8.8|VPN","DNS ошибка|Нет интернета|Таймаут","Почему отдельные сервисы не работают?","Вероятна фильтрация по IP/ASN. VPN переносит трафик.","Какие DNS поставить?","1.1.1.1/1.0.0.1 или 8.8.8.8/8.8.4.4.",,no
/guide/internet-outage-cheboksary-2025/,"Не работает интернет в Чебоксарах сегодня — что делать (2025)","Кратко о причинах и фикcах в Чебоксарах.","Не работает интернет в Чебоксарах сегодня","Проверьте сеть и DNS, при фильтрации — VPN.","интернет в Чебоксарах",outage,"Россия","Нет сети|Медленная загрузка|Таймаут","Смена 3G/4G/5G|Рестарт|DNS 1.1.1.1/8.8.8.8|VPN","Нет соединения|Ошибка DNS|Ограничение","Как понять масштаб?","Сравните с соседями и картой инцидентов.","Что поможет быстро?","VPN + ручной DNS обычно достаточно.",,no
/guide/internet-outage-yoshkar-ola-2025/,"Не работает интернет в Йошкар-Оле сегодня — что делать (2025)","Причины сбоев и быстрые решения для Йошкар-Олы.","Не работает интернет в Йошкар-Оле сегодня","Если доступ нужен срочно — включите VPN и обновите DNS.","интернет в Йошкар-Оле",outage,"Россия","Сайты не открываются|Плохая скорость|Обрывы","Переключите сеть|Перезапуск|DNS 1.1.1.1/8.8.8.8|VPN","DNS ошибка|Нет сети|Ограничение","Почему у меня, а у других работает?","Разные сектора БС/нагрузка. Проверьте SIM/другое устройство.","Какие страны выбрать в VPN?","Нидерланды/Германия; запас — Финляндия/Чехия.",,no
/guide/internet-outage-kirov-2025/,"Не работает интернет в Кирове сегодня — что делать (2025)","Сбой в Кирове: причины и фиксы.","Не работает интернет в Кирове сегодня","Порядок: сеть → перезапуск → DNS → VPN.","интернет в Кирове",outage,"Россия","Сайты не открываются|Низкая скорость|Потери","Смена 3G/4G/5G|Перезапуск устройств|DNS 1.1.1.1/8.8.8.8|VPN","DNS ошибка|Нет сети|Таймаут","Массово или локально?","Сравните с соседями и картой сбоев — станет ясно.","Что сделать быстро?","Включить VPN и обновить DNS.",,no
/guide/internet-outage-izhevsk-2025/,"Не работает интернет в Ижевске сегодня — что делать (2025)","Причины и решения для Ижевска.","Не работает интернет в Ижевске сегодня","Если фильтрация — VPN с обфускацией + DNS вручную.","интернет в Ижевске",outage,"Россия","Не открываются сайты|Лаги|Обрывы","Смена 3G/4G/5G|Рестарт|DNS 1.1.1.1/8.8.8.8|VPN","DNS ошибка|Нет сети|Ограничение","Как отличить массовое от локального?","Проверьте карты сбоев и сообщения оператора.","Что помогает чаще всего?","VPN + корректный DNS.",,no
/guide/internet-outage-votkinsk-2025/,"Не работает интернет в Воткинске сегодня — что делать (2025)","Короткая памятка для Воткинска.","Не работает интернет в Воткинске сегодня","Для «здесь и сейчас»: VPN и DNS вручную.","интернет в Воткинске",outage,"Россия","Сайты не открываются|Медленная загрузка|Потери","Смена сети|Рестарт|DNS 1.1.1.1/8.8.8.8|VPN","DNS ошибка|Нет соединения|Ограничение","Почему падают отдельные сервисы?","Фильтрация/маршрутизация — помогает VPN.","Какие страны выбрать в VPN?","Нидерланды/Германия; запас — Финляндия/Чехия.",,no
/guide/internet-outage-sarapul-2025/,"Не работает интернет в Сарапуле сегодня — что делать (2025)","Сбой в Сарапуле: причины и быстрые фиксы.","Не работает интернет в Сарапуле сегодня","VPN + ручной DNS — рабочее решение до фикса провайдером.","интернет в Сарапуле",outage,"Россия","Нет интернета|Низкая скорость|Потери","Смена сети|Перезапуск устройств|DNS 1.1.1.1/8.8.8.8|VPN","Нет сети|Ошибка DNS|Таймаут","Почему у меня, а у других работает?","Разные сектора БС/нагрузка/оборудование. Проверьте SIM на другом устройстве.","Какие DNS ставить?","1.1.1.1/1.0.0.1 или 8.8.8.8/8.8.4.4.",,no
/guide/internet-outage-glazov-2025/,"Не работает интернет в Глазове сегодня — что делать (2025)","Причины сбоев и быстрые решения для Глазова.","Не работает интернет в Глазове сегодня","Проверьте сеть и DNS; при фильтрации — VPN.","интернет в Глазове",outage,"Россия","Сайты не открываются|Падает скорость|Потери","Смена сети|Перезапуск|DNS 1.1.1.1/8.8.8.8|VPN","Нет сети|Ошибка DNS|Ограничение","Как определить масштаб?","Карта сбоев/сообщения провайдера подскажут.","Что помогает до восстановления?","VPN + ручной DNS часто хватает.",,no
/guide/internet-outage-chaikovsky-2025/,"Не работает интернет в Чайковском сегодня — что делать (2025)","Что делать при сбоях в Чайковском.","Не работает интернет в Чайковском сегодня","Для «здесь и сейчас»: VPN + корректный DNS.","интернет в Чайковском",outage,"Россия","Не открываются приложения|Низкая скорость|Обрывы","Смена 3G/4G/5G|Перезапуск|DNS 1.1.1.1/8.8.8.8|VPN","DNS ошибка|Нет интернета|Таймаут","Почему отдельные сервисы не работают?","Вероятна фильтрация по IP/ASN. VPN переносит трафик.","Какие DNS поставить?","1.1.1.1/1.0.0.1 или 8.8.8.8/8.8.4.4.",,no
/guide/internet-outage-krasnokamsk-2025/,"Не работает интернет в Краснокамске сегодня — что делать (2025)","Кратко о причинах и фикcах в Краснокамске.","Не работает интернет в Краснокамске сегодня","Проверьте сеть и DNS, при фильтрации — VPN.","интернет в Краснокамске",outage,"Россия","Нет сети|Медленная загрузка|Таймаут","Смена 3G/4G/5G|Рестарт|DNS 1.1.1.1/8.8.8.8|VPN","Нет соединения|Ошибка DNS|Ограничение","Как понять масштаб?","Сравните с соседями и картой инцидентов.","Что поможет быстро?","VPN + ручной DNS обычно достаточно.",,no
/guide/internet-outage-naberezhnye-chelny-2025/,"Не работает интернет в Набережных Челнах сегодня — что делать (2025)","Причины сбоев и быстрые решения для Набережных Челнов.","Не работает интернет в Набережных Челнах сегодня","Если доступ нужен срочно — включите VPN и обновите DNS.","интернет в Набережных Челнах",outage,"Россия","Сайты не открываются|Плохая скорость|Обрывы","Переключите сеть|Перезапуск|DNS 1.1.1.1/8.8.8.8|VPN","DNS ошибка|Нет сети|Ограничение","Почему у меня, а у других работает?","Разные сектора БС/нагрузка. Проверьте SIM/другое устройство.","Какие страны выбрать в VPN?","Нидерланды/Германия; запас — Финляндия/Чехия.",,no
/guide/internet-outage-ufa-2025/,"Не работает интернет в Уфе сегодня — что делать (2025)","Сбой в Уфе: причины и фиксы.","Не работает интернет в Уфе сегодня","Порядок: сеть → перезапуск → DNS → VPN.","интернет в Уфе",outage,"Россия","Сайты не открываются|Низкая скорость|Потери","Смена 3G/4G/5G|Перезапуск устройств|DNS 1.1.1.1/8.8.8.8|VPN","DNS ошибка|Нет сети|Таймаут","Массово или локально?","Сравните с соседями и картой сбоев — станет ясно.","Что сделать быстро?","Включить VPN и обновить DNS.",,no
/guide/internet-outage-sibay-2025/,"Не работает интернет в Сибае сегодня — что делать (2025)","Причины и решения для Сибая.","Не работает интернет в Сибае сегодня","Если фильтрация — VPN с обфускацией + DNS вручную.","интернет в Сибае",outage,"Россия","Не открываются сайты|Лаги|Обрывы","Смена 3G/4G/5G|Рестарт|DNS 1.1.1.1/8.8.8.8|VPN","DNS ошибка|Нет сети|Ограничение","Как отличить массовое от локального?","Проверьте карты сбоев и сообщения оператора.","Что помогает чаще всего?","VPN + корректный DNS.",,no
/guide/internet-outage-meleuz-2025/,"Не работает интернет в Мелеузе сегодня — что делать (2025)","Короткая памятка для Мелеуза.","Не работает интернет в Мелеузе сегодня","Для «здесь и сейчас»: VPN и DNS вручную.","интернет в Мелеузе",outage,"Россия","Сайты не открываются|Медленная загрузка|Потери","Смена сети|Рестарт|DNS 1.1.1.1/8.8.8.8|VPN","DNS ошибка|Нет соединения|Ограничение","Почему падают отдельные сервисы?","Фильтрация/маршрутизация — помогает VPN.","Какие страны выбрать в VPN?","Нидерланды/Германия; запас — Финляндия/Чехия.",,no
/guide/internet-outage-kumertau-2025/,"Не работает интернет в Кумертау сегодня — что делать (2025)","Сбой в Кумертау: причины и быстрые фиксы.","Не работает интернет в Кумертау сегодня","VPN + ручной DNS — рабочее решение до фикса провайдером.","интернет в Кумертау",outage,"Россия","Нет интернета|Низкая скорость|Потери","Смена сети|Перезапуск устройств|DNS 1.1.1.1/8.8.8.8|VPN","Нет сети|Ошибка DNS|Таймаут","Почему у меня, а у других работает?","Разные сектора БС/нагрузка/оборудование. Проверьте SIM на другом устройстве.","Какие DNS ставить?","1.1.1.1/1.0.0.1 или 8.8.8.8/8.8.4.4.",,no
/guide/internet-outage-birsk-2025/,"Не работает интернет в Бирске сегодня — что делать (2025)","Причины сбоев и быстрые решения для Бирска.","Не работает интернет в Бирске сегодня","Проверьте сеть и DNS; при фильтрации — VPN.","интернет в Бирске",outage,"Россия","Сайты не открываются|Падает скорость|Потери","Смена сети|Перезапуск|DNS 1.1.1.1/8.8.8.8|VPN","Нет сети|Ошибка DNS|Ограничение","Как определить масштаб?","Карта сбоев/сообщения провайдера подскажут.","Что помогает до восстановления?","VPN + ручной DNS часто хватает.",,no
/guide/internet-outage-orenburg-2025/,"Не работает интернет в Оренбурге сегодня — что делать (2025)","Что делать при сбоях в Оренбурге.","Не работает интернет в Оренбурге сегодня","Для «здесь и сейчас»: VPN + корректный DNS.","интернет в Оренбурге",outage,"Россия","Не открываются приложения|Низкая скорость|Обрывы","Смена 3G/4G/5G|Перезапуск|DNS 1.1.1.1/8.8.8.8|VPN","DNS ошибка|Нет интернета|Таймаут","Почему отдельные сервисы не работают?","Вероятна фильтрация по IP/ASN. VPN переносит трафик.","Какие DNS поставить?","1.1.1.1/1.0.0.1 или 8.8.8.8/8.8.4.4.",,no
/guide/internet-outage-orsk-2025/,"Не работает интернет в Орске сегодня — что делать (2025)","Кратко о причинах и фикcах в Орске.","Не работает интернет в Орске сегодня","Проверьте сеть и DNS, при фильтрации — VPN.","интернет в Орске",outage,"Россия","Нет сети|Медленная загрузка|Таймаут","Смена 3G/4G/5G|Рестарт|DNS 1.1.1.1/8.8.8.8|VPN","Нет соединения|Ошибка DNS|Ограничение","Как понять масштаб?","Сравните с соседями и картой инцидентов.","Что поможет быстро?","VPN + ручной DNS обычно достаточно.",,no
/guide/internet-outage-novotroitsk-2025/,"Не работает интернет в Новотроицке сегодня — что делать (2025)","Причины сбоев и быстрые решения для Новотроицка.","Не работает интернет в Новотроицке сегодня","Если доступ нужен срочно — включите VPN и обновите DNS.","интернет в Новотроицке",outage,"Россия","Сайты не открываются|Плохая скорость|Обрывы","Переключите сеть|Перезапуск|DNS 1.1.1.1/8.8.8.8|VPN","DNS ошибка|Нет сети|Ограничение","Почему у меня, а у других работает?","Разные сектора БС/нагрузка. Проверьте SIM/другое устройство.","Какие страны выбрать в VPN?","Нидерланды/Германия; запас — Финляндия/Чехия.",,no
