url,title,description,h1,lead,service,category,country_hint,problems,fixes,errors,faq1_q,faq1_a,faq2_q,faq2_a,extra_html,noindex
"/guide/internet-outage-krasnodar-2025/","Не работает интернет в Краснодаре сегодня — что делать (2025)","Краснодар: быстрые решения, как вернуть доступ в сеть и обезопасить соединение через VPN.","Не работает интернет в Краснодаре сегодня — что делать","Диагностика + VPN — многие сервисы без него недоступны.","Интернет в Краснодаре","other","—","Нет мобильного интернета|Сайты не открываются|Скорость/пинг плохие|Открывается часть сайтов|Публичный Wi-Fi нестабилен","Самолёт|Перезагрузка|Баланс/ограничения|4G↔3G|DNS 1.1.1.1/8.8.8.8|VPN|Иная сеть","Сеть недоступна|Нет интернета|DNS_PROBE_FINISHED_NXDOMAIN|ERR_CONNECTION_RESET|Региональные ограничения","Как различить локально/массово?","Проверьте работу у другого оператора/устройства и сообщения провайдера. При массовом — ждём, используем VPN.","Публичные сети безопасны?","Нет без VPN.","","no"
"/guide/internet-outage-saratov-2025/","Не работает интернет в Саратове сегодня — что делать (2025)","Саратов: как понять причину сбоя и что поможет прямо сейчас. Плюс VPN.","Не работает интернет в Саратове сегодня — что делать","Даже при доступе многие сервисы заблокированы — VPN обязателен.","Интернет в Саратове","other","—","Нет мобильного интернета|Сайты/приложения не работают|Низкая скорость|Открывается часть сайтов|Риски в публичном Wi-Fi","Самолёт|Перезагрузка|Баланс|4G↔3G|DNS 1.1.1.1/8.8.8.8|VPN|Другая сеть","Нет сети|Нет интернета|DNS_PROBE_FINISHED_NXDOMAIN|ERR_CONNECTION_RESET|Региональные ограничения","Массово ли это?","Сравните с другим устройством/оператором; проверьте сообщения провайдера. При массовом — ожидание + VPN.","Общедоступный Wi-Fi?","Только с VPN.","","no"
"/guide/internet-outage-tyumen-2025/","Не работает интернет в Тюмени сегодня — что делать (2025)","Тюмень: быстрый план действий при сбое + безопасность через VPN.","Не работает интернет в Тюмени сегодня — что делать","Проверка статуса и базовые фиксы; VPN для заблокированных сервисов.","Интернет в Тюмени","other","—","Нет мобильного интернета|Не открываются сайты|Низкая скорость/пинг|Часть сайтов не грузится|Публичный Wi-Fi нестабилен","Самолёт|Перезагрузка|Баланс/лимиты|4G↔3G|DNS 1.1.1.1/8.8.8.8|VPN|Иная сеть","Сеть недоступна|Нет интернета|DNS_PROBE_FINISHED_NXDOMAIN|ERR_CONNECTION_RESET|Региональные ограничения","Это у всех?","Проверьте на другом устройстве и каналы оператора. При массовом — ждём; используем VPN.","Открытые сети?","VPN обязателен.","","no"
"/guide/internet-outage-tolyatti-2025/","Не работает интернет в Тольятти сегодня — что делать (2025)","Тольятти: как проверить соединение, что перезапустить и чем защититься (VPN).","Не работает интернет в Тольятти сегодня — что делать","Даже при рабочем интернете часть сервисов в РФ недоступна — подключайте VPN.","Интернет в Тольятти","other","—","Нет мобильного интернета|Сайты не грузятся|Скорость низкая|Открывается часть сайтов|Публичный Wi-Fi нестабилен","Самолёт|Перезагрузка|Проверка баланса|4G↔3G|DNS 1.1.1.1/8.8.8.8|VPN|Другая сеть","Нет сети|Нет интернета|DNS_PROBE_FINISHED_NXDOMAIN|ERR_CONNECTION_RESET|Региональные ограничения","Массовая авария?","Сверьте на другом устройстве/у провайдера. Массовые сбои решает оператор; временно VPN/альтернативная сеть.","Публичные сети безопасны?","Только через VPN.","","no"
"/guide/internet-outage-izhevsk-2025/","Не работает интернет в Ижевске сегодня — что делать (2025)","Ижевск: краткий чек-лист, как вернуть интернет и защитить соединение (VPN).","Не работает интернет в Ижевске сегодня — что делать","Быстрые фиксы + VPN — для доступа к недоступным сервисам.","Интернет в Ижевске","other","—","Нет мобильного интернета|Сайты/приложения не работают|Низкая скорость|Часть сайтов не открывается|Публичный Wi-Fi нестабилен","Самолёт|Перезагрузка|Баланс/лимиты|4G↔3G|DNS 1.1.1.1/8.8.8.8|VPN|Иная сеть","Сеть недоступна|Нет интернета|DNS_PROBE_FINISHED_NXDOMAIN|ERR_CONNECTION_RESET|Региональные ограничения","Как отличить массовый сбой?","Сравните с другим устройством/оператором, проверьте каналы провайдера. При массовом — ждать, временно VPN.","Публичный Wi-Fi?","Используйте VPN и HTTPS.","","no"
"/guide/internet-outage-barnaul-2025/","Не работает интернет в Барнауле сегодня — что делать (2025)","Барнаул: причины, базовые фиксы и защита соединения (VPN).","Не работает интернет в Барнауле сегодня — что делать","Диагностика сети + VPN для доступа к сервисам.","Интернет в Барнауле","other","—","Нет мобильного интернета|Не открываются сайты|Скорость/пинг низкие|Часть сайтов не грузится|Проблемы публичного Wi-Fi","Самолёт|Перезагрузка|Баланс|4G↔3G|DNS 1.1.1.1/8.8.8.8|VPN|Иная сеть","Сеть недоступна|Нет интернета|DNS_PROBE_FINISHED_NXDOMAIN|ERR_CONNECTION_RESET|Региональные ограничения","Массово или локально?","Проверьте у другого оператора/устройства и сообщения провайдера. При массовом — ожидание; используйте VPN.","Открытые сети — ок?","Только с VPN.","","no"
"/guide/internet-outage-irkutsk-2025/","Не работает интернет в Иркутске сегодня — что делать (2025)","Иркутск: что сделать прямо сейчас и как защитить соединение. Плюс VPN.","Не работает интернет в Иркутске сегодня — что делать","Даже при рабочем интернете многие сервисы заблокированы — держите VPN включённым.","Интернет в Иркутске","other","—","Нет мобильного интернета|Не открываются сайты|Скорость низкая|Часть сайтов не открывается|Публичный Wi-Fi нестабилен","Самолёт|Перезагрузка|Баланс/лимиты|4G↔3G|DNS 1.1.1.1/8.8.8.8|VPN|Иная сеть","Нет сети|Нет интернета|DNS_PROBE_FINISHED_NXDOMAIN|ERR_CONNECTION_RESET|Региональные ограничения","Как понять масштаб?","Сверьте на другом устройстве/операторе и проверьте официальные сообщения. Массовые сбои — время + VPN.","Публичные сети безопасны?","Только с VPN.","","no"
"/guide/internet-outage-ulyanovsk-2025/","Не работает интернет в Ульяновске сегодня — что делать (2025)","Ульяновск: быстрый чек-лист диагностики и защита через VPN.","Не работает интернет в Ульяновске сегодня — что делать","Проверка оператора, перезапуск сети, DNS и VPN — минимальный набор.","Интернет в Ульяновске","other","—","Нет мобильного интернета|Сайты/приложения не грузятся|Низкая скорость|Открывается часть сайтов|Публичный Wi-Fi нестабилен","Самолёт|Перезагрузка|Проверка лимитов|4G↔3G|DNS 1.1.1.1/8.8.8.8|VPN|Другая сеть","Нет сети|Нет интернета|DNS_PROBE_FINISHED_NXDOMAIN|ERR_CONNECTION_RESET|Региональные ограничения","Массовый инцидент?","Сравните с другим устройством/оператором; следите за каналами провайдера. Временно — VPN/альтернативная сеть.","Публичные сети — риск?","Да. Используйте VPN.","","no"
"/guide/internet-outage-khabarovsk-2025/","Не работает интернет в Хабаровске сегодня — что делать (2025)","Хабаровск: что происходит, как проверить статус и что сделать сейчас. Плюс VPN.","Не работает интернет в Хабаровске сегодня — что делать","Даже при доступе многие сервисы требуют VPN — включайте его.","Интернет в Хабаровске","other","—","Нет мобильного интернета|Сайты не открываются|Скорость низкая|Часть сайтов не открывается|Проблемы публичного Wi-Fi","Самолёт|Перезагрузка|Баланс|4G↔3G|DNS 1.1.1.1/8.8.8.8|VPN|Другая сеть","Сеть недоступна|Нет интернета|DNS_PROBE_FINISHED_NXDOMAIN|ERR_CONNECTION_RESET|Региональные ограничения","Это массово?","Проверьте у другого оператора/устройства и сообщения провайдеров. Массовые сбои — ждём/используем VPN.","Публичный Wi-Fi?","Только через VPN.","","no"
"/guide/internet-outage-yaroslavl-2025/","Не работает интернет в Ярославле сегодня — что делать (2025)","Ярославль: причины, фиксы и безопасное подключение через VPN.","Не работает интернет в Ярославле сегодня — что делать","Чек-лист диагностики + VPN для недоступных сервисов.","Интернет в Ярославле","other","—","Нет мобильного интернета|Не открываются сайты|Низкая скорость|Часть сайтов не грузится|Проблемы публичного Wi-Fi","Самолёт|Перезагрузка|Баланс/лимиты|4G↔3G|DNS 1.1.1.1/8.8.8.8|VPN|Иная сеть","Нет сети|Нет интернета|DNS_PROBE_FINISHED_NXDOMAIN|ERR_CONNECTION_RESET|Региональные ограничения","Как определить масштаб?","Сверьте у другого оператора/устройства и посмотрите сообщения провайдеров. Массовые — время + VPN.","Публичные сети — можно?","С VPN — да.","","no"
"/guide/internet-outage-vladivostok-2025/","Не работает интернет во Владивостоке сегодня — что делать (2025)","Владивосток: что проверить и как обезопасить соединение (VPN).","Не работает интернет во Владивостоке сегодня — что делать","Даже при рабочем интернете без VPN часть сервисов недоступна.","Интернет во Владивостоке","other","—","Нет мобильного интернета|Не открываются сайты|Скорость низкая|Открывается часть сайтов|Публичный Wi-Fi нестабилен","Самолёт|Перезагрузка|Лимиты|4G↔3G|DNS 1.1.1.1/8.8.8.8|VPN|Иная сеть","Нет сети|Нет интернета|DNS_PROBE_FINISHED_NXDOMAIN|ERR_CONNECTION_RESET|Региональные ограничения","Массовый сбой?","Проверьте у другого оператора/устройства и официальные каналы. При массовом — ждём, используем VPN.","Публичные сети?","VPN обязателен.","","no"
"/guide/internet-outage-makhachkala-2025/","Не работает интернет в Махачкале сегодня — что делать (2025)","Махачкала: быстрые решения и советы по безопасности (VPN).","Не работает интернет в Махачкале сегодня — что делать","Проверка статуса + DNS + VPN — краткий чек-лист.","Интернет в Махачкале","other","—","Нет мобильного интернета|Сайты не грузятся|Низкая скорость|Открывается часть сайтов|Публичный Wi-Fi нестабилен","Самолёт|Перезагрузка|Баланс|4G↔3G|DNS 1.1.1.1/8.8.8.8|VPN|Другая сеть","Нет сети|Нет интернета|DNS_PROBE_FINISHED_NXDOMAIN|ERR_CONNECTION_RESET|Региональные ограничения","Массово это или нет?","Сверьте с другим устройством/оператором; следите за сообщениями провайдеров. При массовом — ожидание, VPN.","Открытые сети?","Только с VPN.","","no"
"/guide/internet-outage-orenburg-2025/","Не работает интернет в Оренбурге сегодня — что делать (2025)","Оренбург: причины, базовые фиксы и защита соединения (VPN).","Не работает интернет в Оренбурге сегодня — что делать","VPN помогает даже при частичных ограничениях.","Интернет в Оренбурге","other","—","Нет мобильного интернета|Нет доступа к сайтам|Низкая скорость|Часть сайтов не открывается|Публичный Wi-Fi нестабилен","Самолёт|Перезагрузка|Баланс/лимиты|4G↔3G|DNS 1.1.1.1/8.8.8.8|VPN|Иная сеть","Сеть недоступна|Нет интернета|DNS_PROBE_FINISHED_NXDOMAIN|ERR_CONNECTION_RESET|Региональные ограничения","Как понять масштаб?","Проверьте у другого оператора/устройства; смотрите официальные каналы. Массовые — ждём, используем VPN.","Публичные сети?","Только через VPN.","","no"
"/guide/internet-outage-tomsk-2025/","Не работает интернет в Томске сегодня — что делать (2025)","Томск: что проверить и как быстро вернуть доступ. Плюс VPN.","Не работает интернет в Томске сегодня — что делать","Чек-лист: самолёт, перезагрузка, DNS, VPN.","Интернет в Томске","other","—","Нет мобильного интернета|Сайты не открываются|Низкая скорость|Открывается часть сайтов|Проблемы публичного Wi-Fi","Самолёт|Перезагрузка|Проверка баланса|4G↔3G|DNS 1.1.1.1/8.8.8.8|VPN|Другая сеть","Нет сети|Нет интернета|DNS_PROBE_FINISHED_NXDOMAIN|ERR_CONNECTION_RESET|Региональные ограничения","Массово или у меня?","Сравните с другим устройством/оператором; посмотрите сообщения провайдера. При массовом — ожидание; используйте VPN.","Общедоступные сети?","VPN обязателен.","","no"
"/guide/internet-outage-kemerovo-2025/","Не работает интернет в Кемерове сегодня — что делать (2025)","Кемерово: быстрые фиксы и защита соединения (VPN).","Не работает интернет в Кемерове сегодня — что делать","VPN нужен для доступа к ряду сервисов, даже когда сеть работает.","Интернет в Кемерове","other","—","Нет мобильного интернета|Не открываются сайты|Низкая скорость/пинг|Открывается часть сайтов|Публичный Wi-Fi нестабилен","Самолёт|Перезагрузка|Баланс|4G↔3G|DNS 1.1.1.1/8.8.8.8|VPN|Иная сеть","Сеть недоступна|Нет интернета|DNS_PROBE_FINISHED_NXDOMAIN|ERR_CONNECTION_RESET|Региональные ограничения","Массово ли?","Сверьте на другом устройстве/операторе; следите за каналами провайдера. Массовые — ждём, используем VPN.","Публичные сети ок?","Только с VPN.","","no"
"/guide/internet-outage-novokuznetsk-2025/","Не работает интернет в Новокузнецке сегодня — что делать (2025)","Новокузнецк: быстрая диагностика, как вернуть интернет и защитить соединение (VPN).","Не работает интернет в Новокузнецке сегодня — что делать","Проверки + DNS + VPN — минимальный набор.","Интернет в Новокузнецке","other","—","Нет мобильного интернета|Сайты/приложения не грузятся|Низкая скорость|Часть сайтов не открывается|Публичный Wi-Fi нестабилен","Самолёт|Перезагрузка|Баланс/лимиты|4G↔3G|DNS 1.1.1.1/8.8.8.8|VPN|Другая сеть","Нет сети|Нет интернета|DNS_PROBE_FINISHED_NXDOMAIN|ERR_CONNECTION_RESET|Региональные ограничения","Массовый сбой?","Проверьте у другого оператора/устройства и официальные сообщения. При массовом — ожидание; VPN.","Публичные сети?","Только с VPN.","","no"
"/guide/internet-outage-ryazan-2025/","Не работает интернет в Рязани сегодня — что делать (2025)","Рязань: причины, быстрые фиксы, безопасность через VPN.","Не работает интернет в Рязани сегодня — что делать","Даже при рабочем интернете без VPN часть сервисов в РФ недоступна.","Интернет в Рязани","other","—","Нет мобильного интернета|Сайты не открываются|Низкая скорость|Открывается часть сайтов|Проблемы публичного Wi-Fi","Самолёт|Перезагрузка|Лимиты|4G↔3G|DNS 1.1.1.1/8.8.8.8|VPN|Иная сеть","Нет сети|Нет интернета|DNS_PROBE_FINISHED_NXDOMAIN|ERR_CONNECTION_RESET|Региональные ограничения","Как определить масштаб?","Сверьте на другом устройстве/операторе; посмотрите каналы оператора. Массово — ждём, используем VPN.","Публичный Wi-Fi?","VPN обязателен.","","no"
"/guide/internet-outage-naberezhnye-chelny-2025/","Не работает интернет в Набережных Челнах сегодня — что делать (2025)","Набережные Челны: быстрые фиксы + безопасность через VPN.","Не работает интернет в Набережных Челнах сегодня — что делать","Проверьте статус, перезапустите сеть, выставьте DNS и включите VPN.","Интернет в Набережных Челнах","other","—","Нет мобильного интернета|Не открываются сайты|Низкая скорость|Часть сайтов не открывается|Проблемы публичного Wi-Fi","Самолёт|Перезагрузка|Баланс|4G↔3G|DNS 1.1.1.1/8.8.8.8|VPN|Другая сеть","Нет сети|Нет интернета|DNS_PROBE_FINISHED_NXDOMAIN|ERR_CONNECTION_RESET|Региональные ограничения","Массово/локально?","Проверьте у другого оператора/устройства и каналы провайдера. Массовые — ждём; VPN.","Открытые сети?","Только через VPN.","","no"
"/guide/internet-outage-astrakhan-2025/","Не работает интернет в Астрахани сегодня — что делать (2025)","Астрахань: что проверить и как обезопасить соединение (VPN).","Не работает интернет в Астрахани сегодня — что делать","Часть сервисов в РФ без VPN не работает — подключайте.","Интернет в Астрахани","other","—","Нет мобильного интернета|Сайты не открываются|Низкая скорость|Открывается часть сайтов|Проблемы публичного Wi-Fi","Самолёт|Перезагрузка|Лимиты|4G↔3G|DNS 1.1.1.1/8.8.8.8|VPN|Другая сеть","Нет сети|Нет интернета|DNS_PROBE_FINISHED_NXDOMAIN|ERR_CONNECTION_RESET|Региональные ограничения","Масштаб сбоя?","Сверьте на другом устройстве/операторе и проверьте уведомления. Массовые — ждём; VPN.","Публичные сети?","VPN обязателен.","","no"
