url,title,description,h1,lead,service,category,country_hint,problems,fixes,errors,faq1_q,faq1_a,faq2_q,faq2_a,extra_html,noindex
"/guide/internet-outage-moscow-2025/","Не работает интернет в Москве сегодня — что делать (2025)","Сбой мобильного интернета в Москве: что происходит сегодня, как проверить статус оператора и что можно сделать. Быстрые фиксы + защита через VPN.","Не работает интернет в Москве сегодня — что делать","Коротко: проверка статуса у оператора, что перезапустить на телефоне/роутере, и как защищаться — даже при рабочем интернете многие сервисы в РФ недоступны и нужен VPN.","Интернет в Москве","other","—","Не работает мобильный интернет|Нет доступа к сайтам и приложениям|Сильно падает скорость/пинг|Открывается только часть сайтов|Проблемы в публичном Wi-Fi","Включите/выключите режим «в самолёте» на 10–15 сек|Перезагрузите телефон/роутер|Проверьте баланс/лимиты у оператора|Смените 4G↔3G / предпочитаемую сеть|Назначьте DNS 1.1.1.1 или 8.8.8.8|Включите VPN с обфускацией|Попробуйте другую сеть (мобайл↔Wi-Fi)","Сеть недоступна|Нет подключения к интернету|DNS_PROBE_FINISHED_NXDOMAIN|ERR_CONNECTION_RESET|Региональные ограничения","Это массовый сбой или проблема у меня?","Сравните работу сети на другом устройстве/провайдере. Посмотрите каналы поддержки МТС/Мегафон/Билайн/Tele2 и статус-страницы. Если сбой массовый — ждём восстановления; временно используйте другую сеть или VPN.","Насколько безопасно пользоваться публичным Wi-Fi?","Открытые сети небезопасны: трафик могут перехватывать, DNS — подменять. Всегда используйте VPN, отключайте автоподключение к открытым точкам, держите HTTPS и брандмауэр включёнными.","","no"
"/guide/internet-outage-saint-petersburg-2025/","Не работает интернет в Санкт-Петербурге сегодня — что делать (2025)","Сбой мобильного интернета в Санкт-Петербурге: что происходит сегодня, как проверить статус оператора и что сделать. Быстрые фиксы + VPN.","Не работает интернет в Санкт-Петербурге сегодня — что делать","Коротко: как проверить оператора, перезапустить соединение и защититься — многие сервисы в РФ без VPN не работают.","Интернет в Санкт-Петербурге","other","—","Не работает мобильный интернет|Нет доступа к сайтам и приложениям|Падает скорость/пинг|Открывается часть сайтов|Проблемы в публичном Wi-Fi","Режим «в самолёте» 10–15 сек|Перезагрузка телефона/роутера|Проверка баланса/ограничений|Смена 4G↔3G|DNS 1.1.1.1 или 8.8.8.8|VPN с обфускацией|Переход на другую сеть","Сеть недоступна|Нет подключения|DNS_PROBE_FINISHED_NXDOMAIN|ERR_CONNECTION_RESET|Региональные ограничения","Это массовая проблема?","Сверьте работу на другом устройстве/провайдере и проверьте уведомления оператора. При массовом инциденте остаётся ждать; временно используйте альтернативную сеть или VPN.","Безопасен ли публичный Wi-Fi?","Нет. Используйте VPN, отключайте автоподключение, проверяйте HTTPS и обновляйте систему безопасности.","","no"
"/guide/internet-outage-novosibirsk-2025/","Не работает интернет в Новосибирске сегодня — что делать (2025)","Сбой интернета в Новосибирске: как отличить массовую аварию от локальной и что сделать. Быстрые фиксы + VPN.","Не работает интернет в Новосибирске сегодня — что делать","Проверьте статус оператора, перезапустите сеть и выставьте DNS; даже при наличии доступа часть сервисов в РФ заблокирована — нужен VPN.","Интернет в Новосибирске","other","—","Не работает мобильный интернет|Нет доступа к сайтам|Низкая скорость/пинг|Открывается только часть сайтов|Проблемы в публичном Wi-Fi","Режим «в самолёте»|Перезагрузка устройства/роутера|Проверка баланса/лимитов|Смена 4G↔3G|DNS 1.1.1.1/8.8.8.8|VPN с обфускацией|Другая сеть (Wi-Fi↔мобайл)","Сеть недоступна|Нет интернета|DNS_PROBE_FINISHED_NXDOMAIN|ERR_CONNECTION_RESET|Региональные ограничения","Как понять масштаб сбоя?","Проверьте у другого оператора/устройства, посмотрите официальные каналы. Если массово — ждите восстановления, используйте временно другую сеть или VPN.","Публичный Wi-Fi — можно ли?","Только через VPN: иначе риски перехвата и подмены DNS. Отключайте автоподключение.","","no"
"/guide/internet-outage-yekaterinburg-2025/","Не работает интернет в Екатеринбурге сегодня — что делать (2025)","Сбой интернета в Екатеринбурге: причины, быстрые проверки и что поможет прямо сейчас. Плюс защита VPN.","Не работает интернет в Екатеринбурге сегодня — что делать","Сделайте базовую диагностику и включите VPN — многие сервисы остаются недоступными даже при рабочем интернете.","Интернет в Екатеринбурге","other","—","Нет мобильного интернета|Не открываются сайты|Высокий пинг/низкая скорость|Часть сайтов не грузится|Проблемы в публичном Wi-Fi","Режим «в самолёте»|Перезагрузка|Проверка баланса/ограничений|Смена 4G↔3G|DNS 1.1.1.1/8.8.8.8|VPN (обфускация)|Другая сеть","Сеть недоступна|Нет подключения|DNS_PROBE_FINISHED_NXDOMAIN|ERR_CONNECTION_RESET|Региональные ограничения","Массовый сбой или локально?","Сверьте работу на другом устройстве/сети и следите за сообщениями оператора. Массовые аварии требуют времени; временно используйте иную сеть или VPN.","Насколько опасны открытые сети?","Без VPN — опасны. Подмена DNS/перехват трафика. Используйте VPN и HTTPS.","","no"
"/guide/internet-outage-kazan-2025/","Не работает интернет в Казани сегодня — что делать (2025)","Казань: как проверить сбой у оператора, что перезапустить и как защитить соединение. Короткий чек-лист.","Не работает интернет в Казани сегодня — что делать","Проверьте статус, перезапустите соединение, выставьте DNS; для доступа к заблокированным сервисам нужен VPN.","Интернет в Казани","other","—","Нет мобильного интернета|Не грузятся сайты/приложения|Низкая скорость|Открывается часть сайтов|Публичный Wi-Fi нестабилен","«Самолёт» 10–15 сек|Перезагрузка|Проверка лимитов|Смена 4G↔3G|DNS 1.1.1.1/8.8.8.8|VPN (обфускация)|Другая сеть","Сеть недоступна|Нет интернета|DNS_PROBE_FINISHED_NXDOMAIN|ERR_CONNECTION_RESET|Региональные ограничения","Как отличить массовый сбой?","Сравните с другим устройством/оператором, проверьте каналы связи провайдера. При массовом инциденте остаётся ждать, используйте VPN временно.","Открытые сети безопасны?","Нет. Используйте VPN и не храните авто-подключения к открытым точкам.","","no"
"/guide/internet-outage-nizhny-novgorod-2025/","Не работает интернет в Нижнем Новгороде сегодня — что делать (2025)","Нижний Новгород: пошаговая проверка соединения, что сделать прямо сейчас. Плюс VPN.","Не работает интернет в Нижнем Новгороде сегодня — что делать","Даже при рабочем интернете часть сервисов в РФ недоступна — держите VPN включенным.","Интернет в Нижнем Новгороде","other","—","Нет мобильного интернета|Не открываются сайты/приложения|Падает скорость|Открывается часть сайтов|Проблемы в публичном Wi-Fi","Самолёт 10–15 сек|Перезагрузка|Проверка баланса|Смена 4G↔3G|DNS 1.1.1.1/8.8.8.8|VPN (обфускация)|Альтернативная сеть","Сеть недоступна|Нет интернета|DNS_PROBE_FINISHED_NXDOMAIN|ERR_CONNECTION_RESET|Региональные ограничения","Массово или у меня?","Сверьте с другим устройством/провайдером, посмотрите уведомления оператора. Массовые инциденты требуют времени; используйте VPN.","Публичные сети?","Только через VPN — иначе риски MITM и подмены DNS.","","no"
"/guide/internet-outage-chelyabinsk-2025/","Не работает интернет в Челябинске сегодня — что делать (2025)","Челябинск: что проверить у себя и у оператора, быстрые фиксы, безопасность соединения (VPN).","Не работает интернет в Челябинске сегодня — что делать","Сначала базовые проверки и DNS, затем VPN — многие сервисы без него не открываются.","Интернет в Челябинске","other","—","Нет мобильного интернета|Не открываются сайты|Низкая скорость/пинг|Открывается часть сайтов|Проблемы публичного Wi-Fi","Самолёт|Перезагрузка|Проверка лимитов|Смена 4G↔3G|DNS 1.1.1.1/8.8.8.8|VPN (обфускация)|Другая сеть","Сеть недоступна|Нет подключения|DNS_PROBE_FINISHED_NXDOMAIN|ERR_CONNECTION_RESET|Региональные ограничения","Массовая авария?","Проверьте у другого оператора/устройства и официальные сообщения. При массовом — ждём восстановления, используем VPN.","Публичный Wi-Fi безопасен?","Без VPN — нет. Используйте VPN + HTTPS.","","no"
"/guide/internet-outage-samara-2025/","Не работает интернет в Самаре сегодня — что делать (2025)","Самара: быстрый чек-лист, как вернуть доступ, что проверить у оператора и как защититься (VPN).","Не работает интернет в Самаре сегодня — что делать","Даже при рабочем интернете часть сервисов заблокированы — нужен VPN.","Интернет в Самаре","other","—","Нет мобильного интернета|Сайты/приложения не грузятся|Низкая скорость|Часть сайтов открывается|Публичный Wi-Fi нестабилен","Самолёт 10–15 сек|Перезагрузка|Проверка баланса|Смена 4G↔3G|DNS 1.1.1.1/8.8.8.8|VPN|Альтернативная сеть","Сеть недоступна|Нет интернета|DNS_PROBE_FINISHED_NXDOMAIN|ERR_CONNECTION_RESET|Региональные ограничения","Это у всех?","Сравните с другим устройством/провайдером и проверьте каналы оператора. При мас. сбое — ждём; используйте VPN.","Как быть с общедоступным Wi-Fi?","Только с VPN, отключайте авто-подключение.","","no"
"/guide/internet-outage-omsk-2025/","Не работает интернет в Омске сегодня — что делать (2025)","Омск: причины неполадок, что сделать сразу и как обезопасить соединение. Плюс VPN.","Не работает интернет в Омске сегодня — что делать","Пошаговая диагностика + VPN для сервисов, которые в РФ заблокированы.","Интернет в Омске","other","—","Мобильный интернет пропал|Не открываются сайты|Скорость/пинг плохие|Открывается часть сайтов|Риски в публичном Wi-Fi","Самолёт|Перезагрузка|Проверка лимитов|Смена 4G↔3G|DNS 1.1.1.1/8.8.8.8|VPN|Другая сеть","Нет сети|Нет интернета|DNS_PROBE_FINISHED_NXDOMAIN|ERR_CONNECTION_RESET|Региональные ограничения","Как понять масштаб?","Сверьте на другом устройстве/у провайдера, посмотрите сообщения операторов. Массовые инциденты требуют времени; используйте VPN.","Публичные сети — ок?","Только через VPN и HTTPS.","","no"
"/guide/internet-outage-rostov-on-don-2025/","Не работает интернет в Ростове-на-Дону сегодня — что делать (2025)","Ростов-на-Дону: краткий план диагностики и защиты соединения. Плюс VPN.","Не работает интернет в Ростове-на-Дону сегодня — что делать","Быстрые фиксы + DNS + VPN — многие сервисы без него не откроются.","Интернет в Ростове-на-Дону","other","—","Нет мобильного интернета|Сайты/приложения не грузятся|Скорость/пинг низкие|Часть сайтов не открывается|Проблемы публичного Wi-Fi","Самолёт|Перезагрузка|Проверка баланса|4G↔3G|DNS 1.1.1.1/8.8.8.8|VPN (обфускация)|Альтернативная сеть","Сеть недоступна|Нет интернета|DNS_PROBE_FINISHED_NXDOMAIN|ERR_CONNECTION_RESET|Региональные ограничения","Массовый сбой?","Проверьте у другого оператора/устройства; следите за официальными каналами. При массовом — ждём, используем VPN.","Открытые сети безопасны?","Нет — используйте VPN и HTTPS.","","no"
"/guide/internet-outage-ufa-2025/","Не работает интернет в Уфе сегодня — что делать (2025)","Уфа: что проверить у себя/у оператора, быстрые фиксы и защита через VPN.","Не работает интернет в Уфе сегодня — что делать","Даже при наличии доступа часть сервисов в РФ заблокирована — нужен VPN.","Интернет в Уфе","other","—","Нет мобильного интернета|Сайты не открываются|Низкая скорость|Открывается часть сайтов|Проблемы публичного Wi-Fi","Самолёт|Перезагрузка|Проверка баланса|Смена 4G↔3G|DNS 1.1.1.1/8.8.8.8|VPN|Другая сеть","Нет сети|Нет интернета|DNS_PROBE_FINISHED_NXDOMAIN|ERR_CONNECTION_RESET|Региональные ограничения","Массово или локально?","Сверьте с другим устройством/оператором, проверьте уведомления. Массовые аварии решаются у провайдера; используйте VPN.","Публичный Wi-Fi?","Только через VPN; отключите авто-подключение.","","no"
"/guide/internet-outage-krasnoyarsk-2025/","Не работает интернет в Красноярске сегодня — что делать (2025)","Красноярск: быстрый чек-лист диагностики + безопасное подключение через VPN.","Не работает интернет в Красноярске сегодня — что делать","Проверка статуса, перезапуск сети, DNS, VPN — краткий план.","Интернет в Красноярске","other","—","Нет мобильного интернета|Сайты/приложения не грузятся|Низкая скорость/пинг|Часть сайтов не открывается|Риски в публичном Wi-Fi","Самолёт|Перезагрузка|Баланс/лимиты|4G↔3G|DNS 1.1.1.1/8.8.8.8|VPN|Другая сеть","Сеть недоступна|Нет интернета|DNS_PROBE_FINISHED_NXDOMAIN|ERR_CONNECTION_RESET|Региональные ограничения","Что делать при массовом сбое?","Ждать восстановления у оператора; временно перейти на альтернативную сеть/VPN.","Публичные сети безопасны?","Без VPN — нет.","","no"
"/guide/internet-outage-perm-2025/","Не работает интернет в Перми сегодня — что делать (2025)","Пермь: причины недоступности, что проверить и как защитить соединение (VPN).","Не работает интернет в Перми сегодня — что делать","Даже при рабочем интернете часть сервисов заблокирована — используйте VPN.","Интернет в Перми","other","—","Нет мобильного интернета|Не открываются сайты|Скорость/пинг проседают|Открывается часть сайтов|Публичный Wi-Fi нестабилен","Самолёт|Перезагрузка|Проверка лимитов|4G↔3G|DNS 1.1.1.1/8.8.8.8|VPN|Иная сеть","Сеть недоступна|Нет интернета|DNS_PROBE_FINISHED_NXDOMAIN|ERR_CONNECTION_RESET|Региональные ограничения","Как понять масштаб?","Проверьте у другого оператора/устройства и новости оператора. Массовые инциденты требуют времени; используйте VPN.","Можно ли в общедоступные сети?","Только с VPN.","","no"
"/guide/internet-outage-voronezh-2025/","Не работает интернет в Воронеже сегодня — что делать (2025)","Воронеж: быстрая диагностика, что перезапустить, как обезопасить соединение (VPN).","Не работает интернет в Воронеже сегодня — что делать","Пошагово: проверка сети, DNS, VPN — многие сервисы без него не откроются.","Интернет в Воронеже","other","—","Нет мобильного интернета|Сайты не открываются|Низкая скорость|Открывается часть сайтов|Проблемы публичного Wi-Fi","Самолёт|Перезагрузка|Баланс/лимиты|4G↔3G|DNS 1.1.1.1/8.8.8.8|VPN|Другая сеть","Нет сети|Нет интернета|DNS_PROBE_FINISHED_NXDOMAIN|ERR_CONNECTION_RESET|Региональные ограничения","Это массово?","Сравните на другом устройстве/провайдере и проверьте каналы оператора. При массовом — ждём, используем VPN.","Публичные сети ок?","Только с VPN и HTTPS.","","no"
"/guide/internet-outage-volgograd-2025/","Не работает интернет в Волгограде сегодня — что делать (2025)","Волгоград: причины, базовые проверки, безопасное подключение (VPN).","Не работает интернет в Волгограде сегодня — что делать","Чек-лист действий + напоминание про VPN для заблокированных сервисов.","Интернет в Волгограде","other","—","Нет мобильного интернета|Сайты/приложения не грузятся|Скорость низкая|Часть сайтов не открывается|Публичный Wi-Fi нестабилен","Самолёт|Перезагрузка|Баланс/лимиты|4G↔3G|DNS 1.1.1.1/8.8.8.8|VPN|Другая сеть","Нет сети|Нет интернета|DNS_PROBE_FINISHED_NXDOMAIN|ERR_CONNECTION_RESET|Региональные ограничения","Массовый инцидент?","Сверьте с другим устройством/оператором; проверьте каналы провайдера. Временно используйте альтернативную сеть или VPN.","Открытые точки?","Рекомендуем только с VPN.","","no"
