url,title,description,h1,lead,service,category,country_hint,problems,fixes,errors,faq1_q,faq1_a,faq2_q,faq2_a,extra_html,noindex
/guide/internet-outage-bryansk-2025/,"Не работает интернет в Брянске сегодня — что делать (2025)","Сбой интернета в Брянске: причины (работы у оператора, перегрузка БС, фильтрация) и быстрые решения.","Не работает интернет в Брянске сегодня","Проверьте режим сети и DNS. При фильтрации — VPN с обфускацией.","интернет в Брянске",outage,"Россия","Сайты не открываются|Падает скорость|Обрывы связи","Смена 3G/4G/5G|Перезапуск устройств|DNS 1.1.1.1/8.8.8.8|VPN (обфускация)","DNS ошибка|Нет сети|Ограничение доступа","Это массовый сбой или только у меня?","Сравните с соседями и картой инцидентов. Массово чинит оператор, локально проверьте SIM/роутер.","Как открыть сервисы прямо сейчас?","VPN с обфускацией + корректный DNS обычно обходят фильтрацию и возвращают доступ.",,no
/guide/internet-outage-samara-2025/,"Не работает интернет в Самаре сегодня — что делать (2025)","Причины сбоев в Самаре и пошаговые фиксы.","Не работает интернет в Самаре сегодня","Начните с переключения сети и обновления DNS.","интернет в Самаре",outage,"Россия","Не открываются сайты|Низкая скорость|Потери пакетов","Переключите сеть|Рестарт телефона/роутера|DNS 1.1.1.1/8.8.8.8|VPN","Сеть недоступна|DNS ошибка|Таймаут","Почему приложения не подключаются?","Часто действует фильтрация по IP/ASN — помогает VPN.","Какие страны выбрать в VPN?","Стабильно: Нидерланды/Германия; запас — Финляндия/Чехия.",,no
/guide/internet-outage-tolyatti-2025/,"Не работает интернет в Тольятти сегодня — что делать (2025)","Что проверить и как обойти ограничения в Тольятти.","Не работает интернет в Тольятти сегодня","Если нужно срочно — VPN и ручной DNS.","интернет в Тольятти",outage,"Россия","Нет интернета|Медленная загрузка|Обрывы","Смена 3G/4G/5G|Перезапуск|DNS 1.1.1.1/8.8.8.8|VPN","Нет сети|Ошибка DNS|Ограничение","Как понять масштаб проблемы?","Проверьте карты сбоев и чаты района — если массово, ждите оператора.","Что помогает чаще всего?","VPN + корректный DNS до окончания работ.",,no
/guide/internet-outage-syzran-2025/,"Не работает интернет в Сызрани сегодня — что делать (2025)","Сбой в Сызрани: причины и быстрые фиксы.","Не работает интернет в Сызрани сегодня","Если фильтрация — VPN и DNS вручную.","интернет в Сызрани",outage,"Россия","Не открываются сайты|Плохая скорость|Обрывы","Смена 3G/4G/5G|Рестарт|DNS 1.1.1.1/8.8.8.8|VPN","DNS ошибка|Нет сети|Ограничение","Почему не работают отдельные сервисы?","Фильтрация/маршрутизация — помогает VPN.","Какие страны выбрать в VPN?","Нидерланды/Германия; запас — Финляндия/Чехия.",,no
/guide/internet-outage-novokuybyshevsk-2025/,"Не работает интернет в Новокуйбышевске сегодня — что делать (2025)","Причины и быстрые решения для Новокуйбышевска.","Не работает интернет в Новокуйбышевске сегодня","Проверьте режим сети и DNS; при фильтрации — VPN.","интернет в Новокуйбышевске",outage,"Россия","Сайты не открываются|Падает скорость|Потери","Смена сети|Перезапуск|DNS 1.1.1.1/8.8.8.8|VPN","Нет сети|Ошибка DNS|Ограничение","Как определить масштаб?","Карта сбоев/сообщения провайдера подскажут.","Что помогает до восстановления?","VPN + ручной DNS часто хватает.",,no
/guide/internet-outage-saratov-2025/,"Не работает интернет в Саратове сегодня — что делать (2025)","Что делать при сбоях в Саратове.","Не работает интернет в Саратове сегодня","Для «здесь и сейчас»: VPN + корректный DNS.","интернет в Саратове",outage,"Россия","Не открываются приложения|Низкая скорость|Обрывы","Смена 3G/4G/5G|Перезапуск|DNS 1.1.1.1/8.8.8.8|VPN","DNS ошибка|Нет интернета|Таймаут","Почему отдельные сервисы не работают?","Вероятна фильтрация по IP/ASN. VPN переносит трафик.","Какие DNS поставить?","1.1.1.1/1.0.0.1 или 8.8.8.8/8.8.4.4.",,no
/guide/internet-outage-engels-2025/,"Не работает интернет в Энгельсе сегодня — что делать (2025)","Кратко о причинах и фикcах в Энгельсе.","Не работает интернет в Энгельсе сегодня","Проверьте сеть и DNS, при фильтрации — VPN.","интернет в Энгельсе",outage,"Россия","Нет сети|Медленная загрузка|Таймаут","Смена 3G/4G/5G|Рестарт|DNS 1.1.1.1/8.8.8.8|VPN","Нет соединения|Ошибка DNS|Ограничение","Как понять масштаб?","Сравните с соседями и картой инцидентов.","Что поможет быстро?","VPN + ручной DNS обычно достаточно.",,no
/guide/internet-outage-balakovo-2025/,"Не работает интернет в Балакове сегодня — что делать (2025)","Причины сбоев и быстрые решения для Балакова.","Не работает интернет в Балакове сегодня","Если доступ нужен срочно — включите VPN и обновите DNS.","интернет в Балакове",outage,"Россия","Сайты не открываются|Плохая скорость|Обрывы","Переключите сеть|Перезапуск|DNS 1.1.1.1/8.8.8.8|VPN","DNS ошибка|Нет сети|Ограничение","Почему у меня, а у других работает?","Разные сектора БС/нагрузка. Проверьте SIM/другое устройство.","Какие страны выбрать в VPN?","Нидерланды/Германия; запас — Финляндия/Чехия.",,no
/guide/internet-outage-ulyanovsk-2025/,"Не работает интернет в Ульяновске сегодня — что делать (2025)","Сбой в Ульяновске: причины и фиксы.","Не работает интернет в Ульяновске сегодня","Порядок: сеть → перезапуск → DNS → VPN.","интернет в Ульяновске",outage,"Россия","Сайты не открываются|Низкая скорость|Потери","Смена 3G/4G/5G|Перезапуск устройств|DNS 1.1.1.1/8.8.8.8|VPN","DNS ошибка|Нет сети|Таймаут","Массово или локально?","Сравните с соседями и картой сбоев — станет ясно.","Что сделать быстро?","Включить VPN и обновить DNS.",,no
/guide/internet-outage-sterlitamak-2025/,"Не работает интернет в Стерлитамаке сегодня — что делать (2025)","Причины и решения для Стерлитамака.","Не работает интернет в Стерлитамаке сегодня","Если фильтрация — VPN с обфускацией + DNS вручную.","интернет в Стерлитамаке",outage,"Россия","Не открываются сайты|Лаги|Обрывы","Смена 3G/4G/5G|Рестарт|DNS 1.1.1.1/8.8.8.8|VPN","DNS ошибка|Нет сети|Ограничение","Как отличить массовое от локального?","Проверьте карты сбоев и сообщения оператора.","Что помогает чаще всего?","VPN + корректный DNS.",,no
/guide/internet-outage-salavat-2025/,"Не работает интернет в Салавате сегодня — что делать (2025)","Короткая памятка для Салавата.","Не работает интернет в Салавате сегодня","Для «здесь и сейчас»: VPN и DNS вручную.","интернет в Салавате",outage,"Россия","Сайты не открываются|Медленная загрузка|Потери","Смена сети|Рестарт|DNS 1.1.1.1/8.8.8.8|VPN","DNS ошибка|Нет соединения|Ограничение","Почему падают отдельные сервисы?","Фильтрация/маршрутизация — помогает VPN.","Какие страны выбрать в VPN?","Нидерланды/Германия; запас — Финляндия/Чехия.",,no
/guide/internet-outage-neftekamsk-2025/,"Не работает интернет в Нефтекамске сегодня — что делать (2025)","Сбой в Нефтекамске: причины и быстрые фиксы.","Не работает интернет в Нефтекамске сегодня","VPN + ручной DNS — рабочее решение до фикса провайдером.","интернет в Нефтекамске",outage,"Россия","Нет интернета|Низкая скорость|Потери","Смена сети|Перезапуск устройств|DNS 1.1.1.1/8.8.8.8|VPN","Нет сети|Ошибка DNS|Таймаут","Почему у меня, а у других работает?","Разные сектора БС/нагрузка/оборудование. Проверьте SIM на другом устройстве.","Какие DNS ставить?","1.1.1.1/1.0.0.1 или 8.8.8.8/8.8.4.4.",,no
/guide/internet-outage-oktyabrsky-bashkortostan-2025/,"Не работает интернет в Октябрьском (Башкортостан) сегодня — что делать (2025)","Причины и быстрые решения для Октябрьского.","Не работает интернет в Октябрьском сегодня","Проверьте сеть и DNS; при фильтрации — VPN.","интернет в Октябрьском",outage,"Россия","Сайты не открываются|Падает скорость|Потери","Смена 3G/4G/5G|Перезапуск|DNS 1.1.1.1/8.8.8.8|VPN","Нет сети|Ошибка DNS|Ограничение","Как определить масштаб?","Карта сбоев/сообщения провайдера подскажут.","Что помогает до восстановления?","VPN + ручной DNS часто хватает.",,no
/guide/internet-outage-perm-2025/,"Не работает интернет в Перми сегодня — что делать (2025)","Что делать при сбоях в Перми.","Не работает интернет в Перми сегодня","Для «здесь и сейчас»: VPN + корректный DNS.","интернет в Перми",outage,"Россия","Не открываются приложения|Низкая скорость|Обрывы","Смена 3G/4G/5G|Перезапуск|DNS 1.1.1.1/8.8.8.8|VPN","DNS ошибка|Нет интернета|Таймаут","Почему отдельные сервисы не работают?","Вероятна фильтрация по IP/ASN. VPN переносит трафик.","Какие DNS поставить?","1.1.1.1/1.0.0.1 или 8.8.8.8/8.8.4.4.",,no
/guide/internet-outage-berezniki-2025/,"Не работает интернет в Березниках сегодня — что делать (2025)","Кратко о причинах и фикcах в Березниках.","Не работает интернет в Березниках сегодня","Проверьте сеть и DNS, при фильтрации — VPN.","интернет в Березниках",outage,"Россия","Нет сети|Медленная загрузка|Таймаут","Смена 3G/4G/5G|Рестарт|DNS 1.1.1.1/8.8.8.8|VPN","Нет соединения|Ошибка DNS|Ограничение","Как понять масштаб?","Сравните с соседями и картой инцидентов.","Что поможет быстро?","VPN + ручной DNS обычно достаточно.",,no
/guide/internet-outage-pervouralsk-2025/,"Не работает интернет в Первоуральске сегодня — что делать (2025)","Причины сбоев и быстрые решения для Первоуральска.","Не работает интернет в Первоуральске сегодня","Если доступ нужен срочно — включите VPN и обновите DNS.","интернет в Первоуральске",outage,"Россия","Сайты не открываются|Плохая скорость|Обрывы","Переключите сеть|Перезапуск|DNS 1.1.1.1/8.8.8.8|VPN","DNS ошибка|Нет сети|Ограничение","Почему у меня, а у других работает?","Разные сектора БС/нагрузка. Проверьте SIM/другое устройство.","Какие страны выбрать в VPN?","Нидерланды/Германия; запас — Финляндия/Чехия.",,no
/guide/internet-outage-surgut-2025/,"Не работает интернет в Сургуте сегодня — что делать (2025)","Сбой в Сургуте: причины и фиксы.","Не работает интернет в Сургуте сегодня","Порядок: сеть → перезапуск → DNS → VPN.","интернет в Сургуте",outage,"Россия","Сайты не открываются|Низкая скорость|Потери","Смена 3G/4G/5G|Перезапуск устройств|DNS 1.1.1.1/8.8.8.8|VPN","DNS ошибка|Нет сети|Таймаут","Массово или локально?","Сравните с соседями и картой сбоев — станет ясно.","Что сделать быстро?","Включить VPN и обновить DNS.",,no
/guide/internet-outage-nizhnevartovsk-2025/,"Не работает интернет в Нижневартовске сегодня — что делать (2025)","Причины и решения для Нижневартовска.","Не работает интернет в Нижневартовске сегодня","Если фильтрация — VPN с обфускацией + DNS вручную.","интернет в Нижневартовске",outage,"Россия","Не открываются сайты|Лаги|Обрывы","Смена 3G/4G/5G|Рестарт|DNS 1.1.1.1/8.8.8.8|VPN","DNS ошибка|Нет сети|Ограничение","Как отличить массовое от локального?","Проверьте карты сбоев и сообщения оператора.","Что помогает чаще всего?","VPN + корректный DNS.",,no
/guide/internet-outage-nefteyugansk-2025/,"Не работает интернет в Нефтеюганске сегодня — что делать (2025)","Короткая памятка для Нефтеюганска.","Не работает интернет в Нефтеюганске сегодня","Для «здесь и сейчас»: VPN и DNS вручную.","интернет в Нефтеюганске",outage,"Россия","Сайты не открываются|Медленная загрузка|Потери","Смена сети|Рестарт|DNS 1.1.1.1/8.8.8.8|VPN","DNS ошибка|Нет соединения|Ограничение","Почему падают отдельные сервисы?","Фильтрация/маршрутизация — помогает VPN.","Какие страны выбрать в VPN?","Нидерланды/Германия; запас — Финляндия/Чехия.",,no
/guide/internet-outage-khanty-mansiysk-2025/,"Не работает интернет в Ханты-Мансийске сегодня — что делать (2025)","Сбой в Ханты-Мансийске: причины и быстрые фиксы.","Не работает интернет в Ханты-Мансийске сегодня","VPN + ручной DNS — рабочее решение до фикса провайдером.","интернет в Ханты-Мансийске",outage,"Россия","Нет интернета|Низкая скорость|Потери","Смена сети|Перезапуск устройств|DNS 1.1.1.1/8.8.8.8|VPN","Нет сети|Ошибка DNS|Таймаут","Почему у меня, а у других работает?","Разные сектора БС/нагрузка/оборудование. Проверьте SIM на другом устройстве.","Какие DNS ставить?","1.1.1.1/1.0.0.1 или 8.8.8.8/8.8.4.4.",,no
/guide/internet-outage-novy-urengoy-2025/,"Не работает интернет в Новом Уренгое сегодня — что делать (2025)","Причины сбоев и быстрые решения для Нового Уренгоя.","Не работает интернет в Новом Уренгое сегодня","Проверьте сеть и DNS; при фильтрации — VPN.","интернет в Новом Уренгое",outage,"Россия","Сайты не открываются|Падает скорость|Потери","Смена 3G/4G/5G|Перезапуск|DNS 1.1.1.1/8.8.8.8|VPN","Нет сети|Ошибка DNS|Ограничение","Как определить масштаб?","Карта сбоев/сообщения провайдера подскажут.","Что помогает до восстановления?","VPN + ручной DNS часто хватает.",,no
/guide/internet-outage-noyabrsk-2025/,"Не работает интернет в Ноябрьске сегодня — что делать (2025)","Что делать при сбоях в Ноябрьске.","Не работает интернет в Ноябрьске сегодня","Для «здесь и сейчас»: VPN + корректный DNS.","интернет в Ноябрьске",outage,"Россия","Не открываются приложения|Низкая скорость|Обрывы","Смена 3G/4G/5G|Перезапуск|DNS 1.1.1.1/8.8.8.8|VPN","DNS ошибка|Нет интернета|Таймаут","Почему отдельные сервисы не работают?","Вероятна фильтрация по IP/ASN. VPN переносит трафик.","Какие DNS поставить?","1.1.1.1/1.0.0.1 или 8.8.8.8/8.8.4.4.",,no
/guide/internet-outage-seversk-2025/,"Не работает интернет в Северске сегодня — что делать (2025)","Кратко о причинах и фикcах в Северске.","Не работает интернет в Северске сегодня","Проверьте сеть и DNS, при фильтрации — VPN.","интернет в Северске",outage,"Россия","Нет сети|Медленная загрузка|Таймаут","Смена 3G/4G/5G|Рестарт|DNS 1.1.1.1/8.8.8.8|VPN","Нет соединения|Ошибка DNS|Ограничение","Как понять масштаб?","Сравните с соседями и картой инцидентов.","Что поможет быстро?","VPN + ручной DNS обычно достаточно.",,no
/guide/internet-outage-berdsk-2025/,"Не работает интернет в Бердске сегодня — что делать (2025)","Причины сбоев и быстрые решения для Бердска.","Не работает интернет в Бердске сегодня","Если доступ нужен срочно — включите VPN и обновите DNS.","интернет в Бердске",outage,"Россия","Сайты не открываются|Плохая скорость|Обрывы","Переключите сеть|Перезапуск|DNS 1.1.1.1/8.8.8.8|VPN","DNS ошибка|Нет сети|Ограничение","Почему у меня, а у других работает?","Разные сектора БС/нагрузка. Проверьте SIM/другое устройство.","Какие страны выбрать в VPN?","Нидерланды/Германия; запас — Финляндия/Чехия.",,no
/guide/internet-outage-leninsk-kuznetsky-2025/,"Не работает интернет в Ленинске-Кузнецком сегодня — что делать (2025)","Сбой в Ленинске-Кузнецком: причины и фиксы.","Не работает интернет в Ленинске-Кузнецком сегодня","Порядок: сеть → перезапуск → DNS → VPN.","интернет в Ленинске-Кузнецком",outage,"Россия","Сайты не открываются|Низкая скорость|Потери","Смена 3G/4G/5G|Перезапуск устройств|DNS 1.1.1.1/8.8.8.8|VPN","DNS ошибка|Нет сети|Таймаут","Массово или локально?","Сравните с соседями и картой сбоев — станет ясно.","Что сделать быстро?","Включить VPN и обновить DNS.",,no
/guide/internet-outage-mezhdurechensk-2025/,"Не работает интернет в Междуреченске сегодня — что делать (2025)","Причины и решения для Междуреченска.","Не работает интернет в Междуреченске сегодня","Если фильтрация — VPN с обфускацией + DNS вручную.","интернет в Междуреченске",outage,"Россия","Не открываются сайты|Лаги|Обрывы","Смена 3G/4G/5G|Рестарт|DNS 1.1.1.1/8.8.8.8|VPN","DNS ошибка|Нет сети|Ограничение","Как отличить массовое от локального?","Проверьте карты сбоев и сообщения оператора.","Что помогает чаще всего?","VPN + корректный DNS.",,no
/guide/internet-outage-krasnoyarsk-2025/,"Не работает интернет в Красноярске сегодня — что делать (2025)","Короткая памятка для Красноярска.","Не работает интернет в Красноярске сегодня","Для «здесь и сейчас»: VPN и DNS вручную.","интернет в Красноярске",outage,"Россия","Сайты не открываются|Медленная загрузка|Потери","Смена сети|Рестарт|DNS 1.1.1.1/8.8.8.8|VPN","DNS ошибка|Нет соединения|Ограничение","Почему падают отдельные сервисы?","Фильтрация/маршрутизация — помогает VPN.","Какие страны выбрать в VPN?","Нидерланды/Германия; запас — Финляндия/Чехия.",,no
