url,title,description,h1,lead,service,category,country_hint,problems,fixes,errors,faq1_q,faq1_a,faq2_q,faq2_a,extra_html,noindex
/brands/nordvpn-ios-setup-2025/,"NordVPN на iPhone (iOS): настройка и ошибки (2025)","Пошаговая настройка NordVPN на iOS 17/18: протоколы, обфускация, DNS, устранение типовых сбоев.","NordVPN на iPhone — полная настройка","Как установить NordVPN, выбрать протокол, включить обфускацию, настроить DNS и починить частые ошибки на iOS.","NordVPN на iPhone (iOS)","other","Россия","Не подключается|Профиль VPN не появляется|Не работает через LTE/5G|Иконка VPN пропадает|Звонки не проходят","Разрешить VPN-профиль в iOS|Переключить NordLynx/OpenVPN/IKEv2|Включить Obfuscated Servers|Сбросить настройки сети iOS|Ручной DNS 1.1.1.1/8.8.8.8","VPN Authentication Failed|Server did not respond|DNS error|TLS handshake failed","Почему по LTE не работает, а по Wi-Fi работает?","Операторы сильнее фильтруют мобильный трафик. Помогают обфускация и TCP/443.","Нужно ли держать VPN всегда включенным?","Включите On-Demand/Auto-connect, но оставляйте исключения для банковских приложений.",,"no"
/brands/nordvpn-windows-11-setup-2025/,"NordVPN на Windows 11: установка и фиксы (2025)","Как поставить NordVPN на Windows 11: драйверы TUN/TAP/WireGuard, протоколы, DNS и устранение ошибок.","NordVPN на Windows 11 — настройка","Устанавливаем клиент, чиним драйвер, выбираем протокол и возвращаем доступ к сайтам.","NordVPN на Windows 11","other","Россия","Не ставится клиент|Ошибка TAP/WireGuard|Нет интернета после подключения|Не коннектится|Высокий пинг","Переустановка TAP/WG драйвера|Запуск от администратора|OpenVPN TCP/443 при DPI|Отключение конфликтующих фильтров|Сброс DNS-кэша","TAP driver error|Failed to initialize TUN|DNS_PROBE_FINISHED_NXDOMAIN|WFP/Firewall conflict","Как убедиться, что трафик идёт через VPN?","Проверьте внешний IP и трассировку после подключения.","Пропал доступ к локальному принтеру/шаре — почему?","Включите split tunneling или отключите «Use default gateway» для локальных подсетей.",,"no"
/brands/surfshark-ios-setup-2025/,"Surfshark на iPhone (iOS): настройка и ошибки (2025)","Инструкция по настройке Surfshark на iOS: Camouflage/NoBorders, протоколы и DNS.","Surfshark на iPhone — полная настройка","Подключаем Surfshark на iOS, включаем маскировку трафика и устраняем типовые баги.","Surfshark на iPhone (iOS)","other","Россия","Не подключается|Нет VPN-профиля|Через LTE не работает|Чаты/звонки лагают|Иконка VPN мигает","Разрешить профиль|WireGuard↔OpenVPN|Camouflage/NoBorders|Сброс сетей|DNS 1.1.1.1/8.8.8.8","Authentication failed|Timeout|DNS error|Packet loss","Чем отличаются Camouflage и NoBorders?","Оба скрывают VPN-трафик; NoBorders подбирает узлы для сложных сетей.","Как снизить лаги в звонках?","Ближний EU-узел + проводной интернет/5 ГГц и минимум фоновых задач.",,"no"
/brands/surfshark-windows-11-setup-2025/,"Surfshark на Windows 11: установка и фиксы (2025)","Пошаговая установка Surfshark на Windows 11: протокол, драйверы, обход DPI, DNS.","Surfshark на Windows 11 — настройка","Ставим клиент, чиним TAP/WG, включаем TCP/443 и возвращаем скорость.","Surfshark на Windows 11","other","Россия","Ошибка инсталляции|TAP/WG не ставится|Нет интернета|Не подключается|Пинг высокий","Переустановка драйверов|Запуск от администратора|TCP/443 при DPI|Отключение фильтров антивируса|ipconfig /flushdns","TAP error|TUN init failed|DNS_PROBE|Firewall block","Как проверить утечки DNS?","Через онлайн-тесты после подключения — при утечке смените DNS.","Почему падает скорость?","Слабый CPU/UDP режется — пробуйте TCP/443 и близкие узлы.",,"no"
/brands/expressvpn-ios-setup-2025/,"ExpressVPN на iPhone (iOS): настройка и ошибки (2025)","Lightway/OpenVPN, обфускация и DNS — как корректно настроить ExpressVPN на iOS.","ExpressVPN на iPhone — полная настройка","Выбираем протокол, включаем маскировку, настраиваем DNS и чиним частые ошибки.","ExpressVPN на iPhone (iOS)","other","Россия","Не подключается|Нет профиля|Через LTE не работает|Иконка VPN исчезает|Звонки рвутся","Разрешить профиль|Lightway↔OpenVPN|Включить обфускацию|Сброс сетей|DNS 1.1.1.1/8.8.8.8","Auth failed|Server unreachable|DNS error|TLS fail","Когда выбирать Lightway?","Для скорости и стабильности; при DPI переходите на OpenVPN-TCP.","Как стабилизировать звонки?","Ближний узел, закрыть фоновые загрузки, 5 ГГц Wi-Fi.",,"no"
/brands/expressvpn-windows-11-setup-2025/,"ExpressVPN на Windows 11: установка и фиксы (2025)","Настройка ExpressVPN в Windows 11: драйверы, Lightway/OpenVPN, TCP/443, DNS.","ExpressVPN на Windows 11 — настройка","Правильная установка, выбор протокола и устранение сетевых конфликтов.","ExpressVPN на Windows 11","other","Россия","Ошибка установки|Не стартует туннель|Нет сети после коннекта|Высокий пинг","Переустановить драйверы|Выбрать OpenVPN-TCP/443|Отключить конфликтующие фильтры|Сброс DNS","TAP error|TUN init failed|DNS_PROBE|WFP conflict","Как проверить маршрут?","tracert до публичного IP перед и после подключения.","Зачем TCP/443?","Помогает пройти DPI и нестабильные сети провайдеров.",,"no"
/brands/proton-vpn-ios-setup-2025/,"Proton VPN на iPhone (iOS): настройка и ошибки (2025)","Secure Core, протоколы и DNS — как корректно настроить Proton VPN на iOS.","Proton VPN на iPhone — полная настройка","Включаем/отключаем Secure Core, меняем протокол, настраиваем DNS, чиним ошибки.","Proton VPN на iPhone (iOS)","other","Россия","Не подключается|Нет профиля|LTE/5G не работает|Медиа не грузится|Иконка VPN исчезает","Разрешить профиль|WireGuard/OpenVPN/IKEv2|Secure Core вкл/выкл|Сброс сетей|DNS 1.1.1.1","Timeout|Auth failed|DNS error|Handshake","Secure Core всегда держать?","Только при жёсткой фильтрации — скорость может просесть.","Почему Telegram тормозит?","Проверьте локацию и протокол, закройте загрузки/стриминг.",,"no"
/brands/proton-vpn-windows-11-setup-2025/,"Proton VPN на Windows 11: установка и фиксы (2025)","Инсталляция Proton VPN: драйверы, Secure Core, протоколы, TCP/443, DNS.","Proton VPN на Windows 11 — настройка","Устраняем конфликты, выбираем протокол и возвращаем доступ к сервисам.","Proton VPN на Windows 11","other","Россия","Не ставится клиент|TAP/WG ошибки|Нет интернета|Постоянные обрывы|Большой пинг","Переустановка драйверов|TCP/443 при DPI|Secure Core вкл/выкл|Отключить веб-щит|Flush DNS","TAP error|DNS_PROBE|TLS|WFP block","Как подтвердить шифрование трафика?","Проверьте внешний IP/шифр в клиенте и сделайте трассировку.","Как вернуть локальные ресурсы?","Split tunneling или исключение подсетей из маршрута VPN.",,"no"
/brands/cyberghost-ios-setup-2025/,"CyberGhost на iPhone (iOS): настройка и ошибки (2025)","Правильная установка CyberGhost на iOS: протоколы, TCP/443, DNS и диагностика.","CyberGhost на iPhone — полная настройка","Подключаем, меняем протокол/страну, чиним звонки и медиа, настраиваем DNS.","CyberGhost на iPhone (iOS)","other","Россия","Не подключается|Профиль не ставится|LTE не работает|Медиа не грузится|Пинг скачет","Разрешить профиль|WireGuard/OpenVPN|TCP/443|Сброс сетей|Ручной DNS","Auth failed|Timeout|DNS error|Reset","Почему по мобильной сети хуже?","Фильтрация и NAT у оператора — помогает TCP/443 и обфускация.","Какой DNS выбрать?","1.1.1.1 или 8.8.8.8 — проверьте, что утечек нет.",,"no"
/brands/cyberghost-windows-11-setup-2025/,"CyberGhost на Windows 11: установка и фиксы (2025)","Настройка CyberGhost в Windows 11: драйверы, протоколы, обход DPI, DNS.","CyberGhost на Windows 11 — настройка","Ставим клиент, чиним драйвер, выбираем TCP/443 и устраняем конфликты.","CyberGhost на Windows 11","other","Россия","Ошибка установки|Не стартует|Нет сети|После подключения сайты не открываются|Пинг высокий","Переустановка TAP/WG|Запуск от администратора|TCP/443|Отключить фильтры безопасности|Flush DNS","TAP error|TUN fail|DNS_PROBE|Firewall","Как понять, что блокирует антивирус/фаервол?","Временно отключите/создайте правило и проверьте повторно.","Можно ли отделить банк-сайты от VPN?","Да, через split tunneling/исключения в клиенте.",,"no"
/brands/private-internet-access-ios-setup-2025/,"PIA на iPhone (iOS): настройка и ошибки (2025)","Обфускация/Shadowsocks, протоколы и DNS — корректная настройка PIA на iOS.","PIA на iPhone — полная настройка","Подключаем PIA, включаем обфускацию, чиним медиа/звонки и настраиваем DNS.","PIA на iPhone (iOS)","other","Россия","Не подключается|Нет профиля|LTE режет|Медиа не отправляются|Иконка пропадает","Разрешить профиль|WireGuard/OpenVPN|Обфускация/Shadowsocks|Сброс сетей|DNS ручной","Auth fail|Server unreachable|DNS error|Reset","Нужен ли Port Forward на телефоне?","Для мессенджеров не обязателен, он больше про p2p.","Как ускорить работу?","Выбирайте ближние EU-узлы и закрывайте фоновые загрузки.",,"no"
/brands/private-internet-access-windows-11-setup-2025/,"PIA на Windows 11: установка и фиксы (2025)","Установка PIA: драйверы, обфускация, порты 443/1194, DNS, устранение ошибок.","PIA на Windows 11 — настройка","Правильная инсталляция, выбор протокола и портов, починка сети.","Private Internet Access на Windows 11","other","Россия","Ошибка TAP/WG|Нет интернета|Не коннектится|Сайты не открываются|Высокий пинг","Переустановка драйверов|Порт 443 TCP|Отключить фильтры|Flush DNS|Смена узла","TAP error|DNS_PROBE|TLS|WFP conflict","Когда включать обфускацию?","При DPI/фильтрации; без неё быстрее.","Какой протокол быстрее?","Обычно WireGuard; при блоках — OpenVPN-TCP.",,"no"
/brands/windscribe-ios-setup-2025/,"Windscribe на iPhone (iOS): настройка и ошибки (2025)","Stealth/Firewall, протоколы и DNS — как настроить Windscribe на iOS.","Windscribe на iPhone — полная настройка","Включаем Stealth/Firewall, меняем протоколы, настраиваем DNS и чиним типовые баги.","Windscribe на iPhone (iOS)","other","Россия","Не подключается|Нет профиля|LTE не работает|Cannot resolve host|Звонки не идут","Разрешить профиль|WireGuard/OpenVPN|Stealth/Firewall|Сброс сетей|DNS 1.1.1.1","Auth|Timeout|DNS|Reset","Нужен ли Firewall в клиенте?","Иногда помогает при DPI и утечках; протестируйте оба режима.","Как найти «чистый» IP?","Меняйте города и очищайте кэш/ DNS-кеш после переключений.",,"no"
/brands/windscribe-windows-11-setup-2025/,"Windscribe на Windows 11: установка и фиксы (2025)","Как поставить Windscribe на Windows 11: драйверы, Stealth, TCP/443, DNS.","Windscribe на Windows 11 — настройка","Чиним TAP/WG, включаем Stealth/TCP, устраняем утечки DNS.","Windscribe на Windows 11","other","Россия","Ошибка инсталляции|Нет интернета|Cannot resolve host|Постоянные обрывы|Пинг высокий","Переустановка драйверов|TCP/443|Stealth режим|Отключить фильтры|Flush DNS","TAP error|DNS_PROBE|TLS|Firewall","Зачем отдельный DNS в системе?","Чтобы исключить утечки/перехват провайдером.","Как стабилизировать туннель?","Следите за MTU и нагрузкой узла, меняйте города.",,"no"
/brands/mullvad-ios-setup-2025/,"Mullvad на iPhone (iOS): настройка и ошибки (2025)","WireGuard/OpenVPN, Bridge/обфускация и DNS — настройка Mullvad на iOS.","Mullvad на iPhone — полная настройка","Поднимаем Mullvad, включаем Bridge при нужде, настраиваем DNS и чиним ошибки.","Mullvad на iPhone (iOS)","other","Россия","Не подключается|Нет профиля|LTE рвётся|Медиа не грузится|Пинг скачет","Разрешить профиль|WG/OVPN|Bridge/обфускация|Сброс сетей|DNS 1.1.1.1/8.8.8.8","Auth failed|Timeout|DNS error|Reset","Bridge всегда включать?","Только при фильтрации — иначе скорость ниже.","Как выбрать узел?","Ориентируйтесь на пинг/нагрузку в клиенте и закрепляйте лучший.",,"no"
/brands/mullvad-windows-11-setup-2025/,"Mullvad на Windows 11: установка и фиксы (2025)","Инсталляция Mullvad: ключи WG, Bridge/обфускация, TCP/443, DNS, драйверы.","Mullvad на Windows 11 — настройка","Чиним драйвер, включаем нужный режим, устраняем сетевые конфликты.","Mullvad на Windows 11","other","Россия","Не ставится|WG не поднимается|Нет интернета|Сайты не открываются|Пинг высокий","Переустановить драйвер|WG ключи/ротация|TCP/443|Отключить фильтры|Flush DNS","Failed to init WG|DNS_PROBE|TLS|WFP block","Как проверить маршрут до узла?","tracert и сравнение до/после коннекта.","Двуххоп помогает?","Для устойчивости да, но может замедлять — тестируйте.",,"no"
/brands/ipvanish-ios-setup-2025/,"IPVanish на iPhone (iOS): настройка и ошибки (2025)","Scramble/обфускация, выбор протокола и DNS — корректная настройка на iOS.","IPVanish на iPhone — полная настройка","Настраиваем IPVanish, включаем Scramble при DPI и чиним звонки/медиа.","IPVanish на iPhone (iOS)","other","Россия","Не подключается|Нет профиля|LTE не работает|Звонки обрываются|Медиа не грузятся","Разрешить профиль|WG/OVPN|Scramble|Сброс сетей|DNS ручной","Auth|Timeout|DNS|Reset","Зачем Scramble?","Маскирует трафик под HTTPS — помогает в сетях с DPI.","Как снизить лоссы?","Подберите MTU и ближний, менее загруженный узел.",,"no"
/brands/ipvanish-windows-11-setup-2025/,"IPVanish на Windows 11: установка и фиксы (2025)","Драйверы, Scramble, TCP/443, DNS — настраиваем IPVanish под Windows 11.","IPVanish на Windows 11 — настройка","Ставим клиент, чиним драйвер, включаем Scramble/TCP при фильтрации.","IPVanish на Windows 11","other","Россия","Ошибка TAP/WG|Нет сети|Обрывы|Сайты не открываются|Высокий пинг","Переустановка драйверов|TCP/443|Scramble|Отключить фильтры|Flush DNS","TAP error|TLS|DNS_PROBE|Firewall","Поможет ли смена порта?","Нестандартные порты лучше проходят DPI.","Как зафиксировать лучший сервер?","Добавьте в избранное и отключите авто-выбор.",,"no"
/brands/hotspot-shield-ios-setup-2025/,"Hotspot Shield на iPhone (iOS): настройка и ошибки (2025)","Hydra/OpenVPN, TCP/443 и DNS — как настроить Hotspot Shield на iOS.","Hotspot Shield на iPhone — полная настройка","Выбираем протокол, включаем TCP/443 при блоках, задаём DNS и чиним ошибки.","Hotspot Shield на iPhone (iOS)","other","Россия","Не подключается|Профиль не ставится|LTE не работает|Медиа не грузится|Пинг высокий","Разрешить профиль|Hydra↔OpenVPN|TCP/443|Сброс сетей|DNS 1.1.1.1","Auth|Timeout|DNS|Reset","Hydra быстрее?","Часто да, но при DPI лучше TCP/443.","Как стабилизировать работу?","Ближний узел и минимум фоновых задач.",,"no"
/brands/hotspot-shield-windows-11-setup-2025/,"Hotspot Shield на Windows 11: установка и фиксы (2025)","Грамотная установка Hotspot Shield: драйверы, Hydra/OVPN, TCP/443, DNS.","Hotspot Shield на Windows 11 — настройка","Чиним TAP, подбираем протокол/порт и устраняем конфликты фаервола.","Hotspot Shield на Windows 11","other","Россия","Ошибка установки|Нет интернета|Буферизация/лаг|Не открываются сайты|Пинг скачет","Переустановка драйверов|TCP/443|Отключить фильтры|Flush DNS|Смена узла","TAP error|DNS_PROBE|TLS|Firewall block","Как понять, что DPI?","UDP рвётся — TCP/443 обычно проходит.","Нужен ли отдельный DNS?","Да, снижает риск утечек и hijack-страниц.",,"no"
/brands/vyprvpn-ios-setup-2025/,"VyprVPN на iPhone (iOS): настройка и ошибки (2025)","Chameleon, протоколы и DNS — корректная настройка VyprVPN на iOS.","VyprVPN на iPhone — полная настройка","Включаем Chameleon при DPI, подбираем узлы и настраиваем DNS.","VyprVPN на iPhone (iOS)","other","Россия","Не подключается|Профиль не ставится|LTE рвётся|Звонки не идут|Иконка пропадает","Разрешить профиль|Chameleon/OVPN/WG|TCP/443|Сброс сетей|DNS ручной","Auth failed|Timeout|DNS|Reset","Всегда ли включать Chameleon?","Только при фильтрации — иначе скорость ниже.","Какие страны выбрать?","NL/DE/CH; при перегрузе пробуйте CZ/FI.",,"no"
/brands/vyprvpn-windows-11-setup-2025/,"VyprVPN на Windows 11: установка и фиксы (2025)","Настройка VyprVPN в Windows 11: Chameleon/OVPN, TCP/443, DNS и драйверы.","VyprVPN на Windows 11 — настройка","Поднимаем туннель, включаем нужный режим, устраняем ошибки TAP/TUN.","VyprVPN на Windows 11","other","Россия","Ошибка TAP|Нет сети|Не коннектится|Сайты не открываются|Высокий пинг","Переустановить драйвер|OpenVPN-TCP/443|Chameleon при DPI|Отключить фильтры|Flush DNS","TAP error|TLS|DNS_PROBE|WFP","Когда выбирать TCP?","Если UDP режется — TCP/443 устойчивее.","Как оптимизировать пинг?","Ближний узел и проводной интернет.",,"no"
/brands/tunnelbear-ios-setup-2025/,"TunnelBear на iPhone (iOS): настройка и ошибки (2025)","GhostBear, протоколы и DNS — как запустить TunnelBear на iOS без сбоев.","TunnelBear на iPhone — полная настройка","Включаем GhostBear при блоках, выбираем узлы и настраиваем DNS.","TunnelBear на iPhone (iOS)","other","Россия","Не подключается|Профиль не ставится|LTE не работает|Медиа не идёт|Пинг высокий","Разрешить профиль|GhostBear/протокол клиента|TCP режим (если есть)|Сброс сетей|DNS 1.1.1.1","Auth|Timeout|DNS|Reset","GhostBear держать всегда?","Нет, только когда сеть режет VPN.","Какие локации подходят?","NL/DE/FR, меняйте города внутри страны.",,"no"
/brands/tunnelbear-windows-11-setup-2025/,"TunnelBear на Windows 11: установка и фиксы (2025)","Инструкция по установке TunnelBear: драйверы, TCP-режим, DNS и устранение ошибок.","TunnelBear на Windows 11 — настройка","Чиним TAP, выбираем режим, возвращаем доступ к сайтам и стримингу.","TunnelBear на Windows 11","other","Россия","Ошибка установки|Не коннектится|Нет интернета|Плохая скорость|DNS-утечки","Переустановка драйверов|TCP/443 (если доступно)|Отключить фильтры|Flush DNS|Сменить узел","TAP error|DNS_PROBE|TLS|Firewall","Есть ли смысл в бесплатном тарифе?","Для базового серфинга — да; для стриминга — лучше платный.","Как повысить скорость?","Ближние EU-узлы и проводное подключение.",,"no"
